video_id,title,publishedAt,channelId,channelTitle,categoryId,trending_date,tags,view_count,likes,dislikes,comment_count,thumbnail_link,comments_disabled,ratings_disabled,description
"0jz0GAFNNIo","Drake - When To Say When & Chicago Freestyle","2020-03-01T04:13:08.000Z","UCByOQJjav0CUDwxCk-jVNRQ","Drake","10","20.03.03","[none]","6677200","400005","9467","24003","https://i.ytimg.com/vi/0jz0GAFNNIo/default.jpg","False","False","When To Say When & Chicago Freestyle (Official Video)Director: Theo SkudraProducer: Christian TylerExecutive Producer: Leslie McCartneyProduction Company: ColossaleCinematographer: Theo SkudraEditor: Theo SkudraWhen To Say WhenProducer: Gaetan RousseauProducer: Nico ThauProduction Manager: John MorrowLocation Scout: Conlan OlberdingB Cam Operator: Pierrick Reiss1st AC (A Cam): Tsyen Shen1st AC (B Cam): Luna Burns 1st AC: Vincent Howard2nd AC: Greg HowardGaffer: John WardGaffer: Amaal MustafaBest Boy Electric: Jonathan MejiaKey Grip: Phil SokoloffBest Boy Grip: Kurtis RileyDriver: Jonathan Charles Equipment Van Driver: Iraki KurdianiSet PA: Sebastien Le CozSet PA: Achille VanderhaeghenChicago FreestyleProduction Coordinator: Cameron Frangopoulos1st AC: Nick Coffin1st AC: Nick PetrieGaffer: Alex PoutiainenSteady Cam: Greg FrankovichConform & Online: Assembly RepsColour: ArtjailColourist: Clinton HomuthFilm Processed at FotoKem Los Angeles Senior Dailies Producer: Mary Chamberlain"
"zF9PdMVteOQ","Real Madrid 2 - 0 FC Barcelona - HIGHLIGHTS & GOALS - 03/01/2020","2020-03-01T22:12:32.000Z","UC0YatYmg5JRYzXJPxIdRd8g","beIN SPORTS USA","17","20.03.03","beIN SPORTS|beIN SPORTS USA|Futbol|Football|real madrid|rma fcb|real madrid barcelona|barcelona|vinicius jr|vinicius jr goal|mariano goal|mariano|vinicius|zidane|fc barcelona|republica dominicana|santiago bernabeu|cristobal soria|y vinicius pa cuando remix|y vinicius pa cuando roncero|y vinicius pa cuando programa completo|y vinicius pa cuando|tito soria","973644","12040","844","2423","https://i.ytimg.com/vi/zF9PdMVteOQ/default.jpg","False","False","Real Madrid fought a hard battle to come victorious in this year's first #ElClasico. Vinicius Jr. & Mariano unexpected heroes.Real Madrid peleó una dura batalla para salir avante del primer clásico del año. Héroes inesperados: Vinicius Jr. y Mariano. Connect with beIN SPORTS Online:Watch us on TV: http://bit.ly/2d7bf5YWatch us Online: http://bit.ly/1WNtvkcVisit our WEBSITE: http://beINSPORTS.comLike us on FACEBOOK: http://facebook.com/beINSPORTSUSAFollow us on TWITTER: http://twitter.com/beINSPORTSUSAFollow us on INSTAGRAM: http://instagram.com/beINSPORTSUSA#LaLiga #RealMadrid #Barcelona"
"_c17qFtgxFw","IDOL HISTORY IS MADE as a Contestant Walks In Off the Street to Auditon - American Idol 2020","2020-03-02T01:42:58.000Z","UCAMPco9PqjBbI_MLsDOO4Jw","American Idol","24","20.03.03","American Idol 2019|American Idol|singing competition|Katy Perry|Ryan Seacrest|Luke Bryan|Lionel Richie|covers|sing|ABC|Courtney Timmons|Rise Up|Andra Day","928322","25660","314","1654","https://i.ytimg.com/vi/_c17qFtgxFw/default.jpg","False","False","Courtney Timmons walks in off of the street to audition for American Idol. She brings Ryan Seacrest to tears, but will her audition of Rise Up by Andra Day be enough to convince Katy Perry, Lionel Richie and Luke Bryan?See more of American Idol 2020 on our official site: http://www.americanidol.comLike American Idol on Facebook: https://www.facebook.com/AmericanIdolFollow American Idol on Twitter: https://twitter.com/americanidolFollow American Idol on Instagram: https://www.instagram.com/americanidol/AMERICAN IDOL, the iconic series that revolutionized the television landscape by pioneering the music competition genre, returns on ABC.American Idol 2020Helping to determine who America will ultimately vote for to become the next singing sensation are music industry forces and superstar judges Luke Bryan, Katy Perry and Lionel Richie. Emmy® Award-winning host and producer Ryan Seacrest continues as host of the beloved series, while multimedia personality Bobby Bones serves at the in-house mentor."
"PR-duMh19FY","Lil Uzi Vert - That Way [Official Audio]","2020-03-01T17:50:24.000Z","UCqwxMqUcL-XC3D9-fTP93Mg","LIL UZI VERT","10","20.03.03","Lil|Uzi|Vert|Lil Uzi Vert|lil uzi|lil uzi vert|lil uzi vert futsal shuffle 2020|lil uzi futsal shuffle 2020|futsal shuffle 2020|futsal shuffle|lil uzi futsal shuffle|lil uzi 2020|lil uzi futsal|lil uzi futbal shuffle|luv is rage|luve is rage 2|the way life goes|l.u.v.|luv|sanguine paradise|you was right|ps and qs|xo tour life|xo tour llif3|money longer|That Way|UziGang|nwE_BsjBSUw","1895043","232595","3237","21607","https://i.ytimg.com/vi/PR-duMh19FY/default.jpg","False","False","Lil Uzi Vert - That WayDownload/Stream: https://Uzi.lnk.to/ThatWayConnect with Lil Uzi Vert:https://twitter.com/LILUZIVERThttps://www.instagram.com/liluzivert/https://www.facebook.com/LilUziVert/https://www.youtube.com/user/LILUZIVERThttp://liluziofficial.com/"
"bzs_l5-Emzo","Try Not To Get Anxiety Challenge #2","2020-03-01T16:25:00.000Z","UCYzPXprvl5Y-Sf0g4vX-m6g","jacksepticeye","23","20.03.03","jacksepticeye|try not to get anxiety|try not to get anxiety challenge|try not to get anxiety jacksepticeye|challenge|challenge videos|try not to anxiety|try not to get anxiety heights|try not to get anxiety impossible|anxiety challenge|impossible challenge|try not to|scared|reddit|sweaty palms|crazy challenge|try not to challenge|jacksepticeye challenge|funny|funny videos|funny try not to get anxiety challenge video","1289199","96157","1092","8047","https://i.ytimg.com/vi/bzs_l5-Emzo/default.jpg","False","False","Welcome back to the try not to get anxiety challenge. Last time I failed very badly, how will we do this time? SUB TO BE EPIC - https://www.youtube.com/user/jacksepticeye?sub_confirmation=1Become a Sponsor: https://youtube.com/jacksepticeye/join►Twitter : https://twitter.com/Jack_Septic_Eye►Instagram: http://instagram.com/jacksepticeye"
"dlk7Q2t_-HM","The OFFICIAL GENDER REVEAL Of THE ROYALTY FAMILY! **BOY or GIRL?**.","2020-03-01T16:00:56.000Z","UCja7QUMRG9AD8X2F_vXFb9A","The Royalty Family","22","20.03.03","The Royalty Family|Royalty Family|Andrea Espada|Family Friendly|gender reveal|boy or girl|official gender reveal|royalty family gender reveal|royalty family baby|official gender reveal of the royalty family|ferran|royalty|royalty family challenges|official gender|boy|girl|family vlog|reveal gender|the official|royal|royal gender reveal","2353742","123639","6356","0","https://i.ytimg.com/vi/dlk7Q2t_-HM/default.jpg","True","False","The OFFICIAL GENDER REVEAL Of THE ROYALTY FAMILY! Boy or Girl?𝐒𝐔𝐁𝐒𝐂𝐑𝐈𝐁𝐄 ᕼEᖇE! ➡ https://youtube.com/RoyaltyFamMERCH ➡ https://royalty.laWe Tested VIRAL TikTok LIFE HACKS... **THEY WORKED** ➡ https://youtu.be/2vvr4PQ9ma4TELLING OUR SON FERRAN WE'RE HAVING a BABY! EMOTIONAL...➡ https://youtu.be/bjrHdVM3zl8#GenderReveal #FamilyVlog #TheRoyaltyFamilyWatch our RECENT VIDEOS  ➡ https://bit.ly/2JotKG4Watch Our POPULAR VIDEOS! ➡ http://bit.ly/2NgagCxWatch Our CHALLENGES  ➡ https://bit.ly/2kqDqVD FOLLOW IᑎᔕTᗩGᖇᗩᗰ HERE ☟ANDREA ➡ https://www.instagram.com/andreaespadatv/ALI           ➡https://www.instagram.com/4kpapi/FERRAN  ➡https://www.instagram.com/kingferran/BUSINESS INQUIRIES ➡ @AndreaEspada.Bookings@Gmail.comWelcome To THE ROYALTY FAMILY Youtube Channel. We are a modern blended family based in Los Angeles that love to entertain you. We believe in family, fun, Love and are passionate about fashion, comedy and culture. Join us every week in sharing the good times of Andrea, Ali, Ferran and our Chihuahua Princesa. Best of all, we believe everyone can be ROYALTY so don’t forget to SUBSCRIBE!!The OFFICIAL GENDER REVEAL Of THE ROYALTY FAMILY! **BOY or GIRL?**.https://youtu.be/dlk7Q2t_-HMThe Royalty Familyhttps://www.youtube.com/channel/UCja7QUMRG9AD8X2F_vXFb9A"
"1AElONvi9WQ","Why Blue Whales Don't Get Cancer - Peto's Paradox","2020-03-01T13:30:00.000Z","UCsXVk37bltHxD1rDPwtNM8Q","Kurzgesagt – In a Nutshell","27","20.03.03","Cancer|healing|peto’s paradox|paradox|peto|therapy|biology|rhinoceros|blue whale|mouse|elephant|giraffe|cell|human cell|body cell|cancer cell|immune system|cancer rate|human being|evolution|hyper tumor|hyper parasite|mutation|Gene|DNA|proto oncogene|tumor suppressor gene|caretaker|gatekeeper|age|aging|ulcer|tumor|metabolism|cell structure","2860166","246243","1203","9158","https://i.ytimg.com/vi/1AElONvi9WQ/default.jpg","False","False","Get Merch designed with ❤ from https://kgs.link/shop  Join the Patreon Bird Army 🐧 https://kgs.link/patreon  ▼▼ More infos and links are just a click away ▼▼Cancer is a creepy and mysterious thing. While we tried to understand it, to get better at killing it, we discovered a biological paradox that remains unsolved to this day: large animals seem to be immune to cancer. Which doesn’t make any sense – the bigger a being, the more cancer it should have. To understand why, we first need to take a look at the nature of cancer itself.Sources & further reading: https://sites.google.com/view/sourcespetosparadox/OUR CHANNELS▀▀▀▀▀▀▀▀▀▀▀▀▀▀▀▀▀▀▀▀▀▀▀▀▀▀German Channel: https://kgs.link/youtubeDE by FUNKSpanish Channel: https://kgs.link/youtubeES by WIXHOW CAN YOU SUPPORT US?▀▀▀▀▀▀▀▀▀▀▀▀▀▀▀▀▀▀▀▀▀▀▀▀▀▀This is how we make our living and it would be a pleasure if you support us!Get Merch designed with ❤ from https://kgs.link/shop  Join the Patreon Bird Army 🐧 https://kgs.link/patreon  DISCUSSIONS & SOCIAL MEDIA▀▀▀▀▀▀▀▀▀▀▀▀▀▀▀▀▀▀▀▀▀▀▀▀▀▀Reddit:            https://kgs.link/redditInstagram:     https://kgs.link/instragramTwitter:           https://kgs.link/twitterFacebook:      https://kgs.link/facebookDiscord:          https://kgs.link/discordNewsletter:    https://kgs.link/newsletterOUR VOICE▀▀▀▀▀▀▀▀▀▀▀▀▀▀▀▀▀▀▀▀▀▀▀▀▀▀The Kurzgesagt voice is from Steve Taylor:  https://kgs.link/youtube-voiceOUR MUSIC ♬♪▀▀▀▀▀▀▀▀▀▀▀▀▀▀▀▀▀▀▀▀▀▀▀▀▀▀700+ minutes of Kurzgesagt Soundtracks by Epic Mountain:Spotify:            https://kgs.link/music-spotifySoundcloud:   https://kgs.link/music-soundcloudBandcamp:     https://kgs.link/music-bandcampYoutube:          https://kgs.link/music-youtubeFacebook:       https://kgs.link/music-facebookThe Soundtrack of this video:Soundcloud:   https://bit.ly/3cjYgvWBandcamp:     https://bit.ly/39h7E1C🐦🐧🐤 PATREON BIRD ARMY 🐤🐧🐦▀▀▀▀▀▀▀▀▀▀▀▀▀▀▀▀▀▀▀▀▀▀▀▀▀▀Many Thanks to our wonderful Patreons from http://kgs.link/patreon who support us every month and made this video possible:Dennis Barzanoff, HGING231, Taylor Sutton, Agazzy Kan, Isabelle Sagastume, Richard Larsen, Carini, Arvīds Pelēcis, chrisnov, Anish Weerasooriya, Erik Stafford, Apoorva Chandra, Renee Annan, Alex Cross, Jan Karlík, Alexander Fielding, Lukas Schmidt, André, Jianzhuo Wu, Dina Andrei, Iskandar 323, Promethius84 ., Michael Altherr, Devon Meyer, Honza Tomášek, Da Yi, stephanie santos, Kyrill Abrams, Scott Blechman, Alexandre Valdetaro, Balázs Varju, TheBozzCL, Bufe, Mr_Blu42, Kamil, Scott, Alan Lu, Chris Gardner, Youssef Adib, Sean Markham, R, Severin Klingler, Sebastian, Gurneel Kang, SatanicPanic, ohad shalev, Grayson Gordon, 健樑 黃, Taavi Taijala, Lara Rimassa, Paul Wittau, Sir. Forest, schanuel, Cleo Wong, Mihaela Ciobanu, Tibor, secure taka, GeF, rolf redford, Martin Kärgell, Devyn Phillips, Tiger Darian"
"D0v7sERrjpE","Another Book I Made as an Adult (and book tour!)","2020-03-01T17:38:02.000Z","UCo8bcnLyZH8tBIH9V1mLgqQ","TheOdd1sOut","23","20.03.03","[none]","2242982","167356","2766","22160","https://i.ytimg.com/vi/D0v7sERrjpE/default.jpg","False","False","Get tickets to my book tour ➤ https://theodd1sout.com/pages/eventsPre-Order my book ➤ https://theodd1sout.com/pages/the-first-sequel Second Channel ➤ https://www.youtube.com/channel/UC0GLNhtTu7yI8rl6ZZGeezw Everyone who worked on the bookRushlight Invader ➤ https://www.youtube.com/user/RushLightInvader Annie Loomis ➤ https://twitter.com/annieloomisart  PantslessPajamas ➤ https://www.youtube.com/channel/UCR0O-1cvuPNxDosvSDLpWHg Hexrin ➤ https://twitter.com/hexriin Kat ➤ https://twitter.com/NineDoodles funymony ➤ https://www.youtube.com/user/funymony Nine Doodles ➤ https://twitter.com/NineDoodlesFunyMony ➤ https://twitter.com/funymonyHiro the Hiroshark ➤ https://twitter.com/HirosharkTom Martin ➤ https://www.undeadwizard.com/artSecond channel ➤ https://www.youtube.com/channel/UC0GLNhtTu7yI8rl6ZZGeezw Twitter ➤ https://twitter.com/Theodd1sout Instagram ➤ https://www.instagram.com/theodd1sout/ Website/Merch ➤ https://theodd1sout.com/"
"hsWr_JWTZss","The Trouble With Tumbleweed","2020-03-01T18:15:00.000Z","UC2C_jShtL725hvbm1arSV9w","CGP Grey","27","20.03.03","cgpgrey|education|farming|agriculture|tumbleweed","1187616","82570","468","4029","https://i.ytimg.com/vi/hsWr_JWTZss/default.jpg","False","False","1 hour + director's commentary on this video: https://www.youtube.com/watch?v=rbHQObTeLDMDiscuss on the reddit: https://www.reddit.com/r/CGPGrey/comments/fc12xr/the_trouble_with_tumbles/## Crowdfunders:Bob Kunz, Steven Snow, John Buchan, Nevin Spoljaric, Donal Botkin, Phil Gardner, Chris Chapin, Richard Jenkins, Martin, Steven Grimm, سليمان العقل, Colin Millions, Michael Mrozek, Saki Comandao, Jason Lewandowski, Andrea Di Biagio, David F Watson, rictic, Ben Schwab, Marco Arment, Elliot Lepley, Shantanu Raj, emptymachine, Bobby, Chris Amaris, George Lin, Mikko, Derek Bonner, Derek Jackson, Orbit_Junkie, Ron Bowes, Tómas Árni Jónasson, Henry Ng, Jordan Earls, Joshua Jamison, Nick Fish, Nick Gibson, Robert Webb, Jeffrey Podis, Thunda Plum, Awoo, David Tyler, Fuesu, iulus, Kevin Costello, Michael Reilly, Tyler Bryant, Kermit Norlund, chrysilis, David Palomares, Erik Parasiuk, ken mcfarlane, Leon, Tristan Watts-Willis, Veronica Peshterianu, Bear, Emi, Esteban Santana Santana, Freddi Hørlyck, John Rogers, Maarten van der Blij, Peter Lomax, Rhys Parry, ShiroiYami, Dag Viggo Lokøen, John Lee, Maxime Zielony, Elizabeth Keathley, Frederick The Great, Luxe Gifts, Rebecca Wortham, Bryan McLemoreMusic by: http://www.davidreesmusic.com"
"F4Y3Pkn95GI","I Ate A $70,000 Golden Pizza","2020-02-29T21:00:22.000Z","UCX6OQ3DkcsbYNE6H8uQQuVA","MrBeast","24","20.03.03","[none]","12889417","798838","14260","45022","https://i.ytimg.com/vi/F4Y3Pkn95GI/default.jpg","False","False","I cant believe we actually did this...Please vote and help me win a Kids Choice Award (I'm on page 20) https://kca.nick.tv/vote/vote now or ill delete your fortnite accountNew Merch - https://shopmrbeast.com/SUBSCRIBE OR I TAKE YOUR DOG----------------------------------------------------------------follow all of these or i will kick you• Facebook - https://www.facebook.com/MrBeast6000/• Twitter - https://twitter.com/MrBeastYT•  Instagram - https://www.instagram.com/mrbeast--------------------------------------------------------------------"
"YOteXc3EIkY","Coronavirus outbreak: Be prepared to delay upcoming holidays because of COVID-19","2020-03-01T16:00:04.000Z","UChLtXXpo4Ge1ReTEboVvTDg","Global News","25","20.03.03","Coronavirus|Coronavirus outbreak|coronavirus travel|covid-19|covid19|public health|Pan American Health Organization|Dr. Marcos Espinal|Global News|The West Block|Ottawa|Health|Coronavirus canada|covid-19 canada|travelling with coronavirus|pandemic|epidemic|latest uploads","348025","2318","373","1363","https://i.ytimg.com/vi/YOteXc3EIkY/default.jpg","False","False","Dr. Marcos Espinal of the Pan American Health Organization tells Mercedes Stephenson people need to keep watch of which areas are being affected by the coronavirus and postpone travel to those areas to protect your life.For more info, please go to https://globalnews.ca/news/6608822/coronavirus-risk-very-high-meaning/Subscribe to Global News Channel HERE: http://bit.ly/20fcXDcLike Global News on Facebook HERE: http://bit.ly/255GMJQFollow Global News on Twitter HERE: http://bit.ly/1Toz8mtFollow Global News on Instagram HERE: https://bit.ly/2QZaZIB#Coronavirus #COVID19 #Travel #GlobalNews"
"3ipoXHpG1VQ","ULTIMATE VEGGIE BURGER TASTE TEST *FAST FOOD*","2020-03-01T21:47:33.000Z","UC78cxCAcp7JfQPgKxYdyGrg","emma chamberlain","24","20.03.03","emma chamberlain|emma chambie|vlog|veggie burger|vegan|taste test","1042002","81659","559","4287","https://i.ytimg.com/vi/3ipoXHpG1VQ/default.jpg","False","False","i try it, so you don't have to✩ CHECK OUT CHAMBERLAIN COFFEE ✩✭ website: https://www.chamberlaincoffee.com ✭ instagram: https://www.instagram.com/chamberlain...✩ MY SOCIAL MEDIA ✩✭ instagram: https://www.instagram.com/emmachamber...✭ twitter: https://twitter.com/emmachamberlain✭ tik tok (lol): emmachamberlain✭ snapchat: https://www.snapchat.com/emmachambie✭ spotify: http://open.spotify.com/user/emmachambie ✩ MY PODCAST ✩✭ search Anything Goes on spotify, apple podcasts, or wherever else you get your podcasts...✩ MERCH ✩✭  https://shopemmachamberlain.com (COMING SOON)I LUV U,-emma chamberlain"
"VdLCHsgse7U","UFC 248 Countdown: Adesanya vs Romero","2020-03-01T20:00:02.000Z","UCvgfXK4nTYKudb0rFR6noLA","UFC - Ultimate Fighting Championship","17","20.03.03","ufc|248|countdown|israel|adesanya|yoel|romero|segment|preview|show|middleweight|title|championship|promo|behind|the|scenes|training|fight|camp|episode|mma|ultimate fighting championship","917994","16427","440","3247","https://i.ytimg.com/vi/VdLCHsgse7U/default.jpg","False","False","At UFC 248, middleweight champion Israel Adesanya faces the dangerous Yoel Romero.  See these two athletes train and prepare for their upcoming bout on March 7.Subscribe to get all the latest UFC content: http://bit.ly/2uJRzRRExperience UFC live with UFC FIGHT PASS, the digital subscription service of the UFC. Visit https://ufcfightpass.com/To order UFC Pay-Per-Views on ESPN+, visit https://bit.ly/2vNIBE8 (U.S. only)To order UFC Pay-Per-Views, visit http://welcome.ufcfightpass.com/#PPV (Non U.S.)Connect with UFC online and on Social:Website: http://www.ufc.comTwitter: http://www.twitter.com/ufcFacebook: http://www.facebook.com/ufcInstagram: http://www.instagram.com/ufcSnapchat: UFCPeriscope: http://Periscope.tv/ufcConnect with UFC FIGHT PASS on Social:Twitter: http://www.twitter.com/ufcfightpassFacebook: http://www.facebook.com/ufcfightpassInstagram: http://www.instagram.com/ufcfightpass"
"k8fBQ0N5354","When you ACTUALLY answer a 'Scam Likely' call","2020-03-02T01:09:01.000Z","UCI1XS_GkLGDOgf8YLaaXNRA","CalebCity","23","20.03.03","[none]","948144","145657","539","6091","https://i.ytimg.com/vi/k8fBQ0N5354/default.jpg","False","False","I actually yelled at a scam caller to stop before and they just hung up 😠...then they called laterMusicOddwin - 19"
"R189VzXyt2Q","Hairdresser Reacts to Worst Bleach Fail Ever","2020-03-01T21:59:29.000Z","UCoc_XJPj6YLMQDWtPDQcDtA","Brad Mondo","24","20.03.03","bradmondo|bradmondonyc|hairdresserreacts|Hairdresser Reacts to Worst Bleach Fail Ever|hairdresser reacts|hair fail|30 vol|hair stylist|fall off|manic panic|diy hair|hair dresser|at home|40 vol|gone wrong|video react|funny fails|box dye|hair fails|bleach fail|jenna marbles|natural hair|bleaching hair at home|pink hair|blue hair|how to bleach hair at home|hairdresser reacts to bleach fails|hair cut|fall out|hair fail compilation","798453","44641","435","6295","https://i.ytimg.com/vi/R189VzXyt2Q/default.jpg","False","False","Hi Beautiful! This must be the worst bleach disaster I've ever seen in my life. I didn't even know what to say. Shop XMONDO Hair: https://www.xmondohair.com/Baylea Wilk Video: https://www.youtube.com/watch?v=bcONgI0DmO8&t=1091sInstagram: https://www.instagram.com/bradmondonyc/Twitter: https://twitter.com/bradmondonycTikTok: https://www.tiktok.com/@bradmondonyc?utm_source=tt_10XMONDO Instagram:  https://www.instagram.com/xmondohair/Video Editing By: Kris Edrosa Don't Forget To Live Your Extra Life."
"5S8XuGmK4zo","Tapper presses Pence: Do you think Democrats want people to get coronavirus?","2020-03-01T14:48:21.000Z","UCupvZG-5ko_eiXAupbDfxWw","CNN","25","20.03.03","latest News|Happening Now|CNN|Mike Pence|Jake Tapper|State of the Union|Politics","489514","3688","2641","8362","https://i.ytimg.com/vi/5S8XuGmK4zo/default.jpg","False","False","CNN's Jake Tapper talks to Vice President Mike Pence about the coronavirus and the White House's preparedness to handle the potential spread across the US.#CNN #News"
"MiqElS_RfPw","Mike Was Wrong!!!!","2020-03-01T23:50:34.000Z","UCrTNhL_yO3tPTdQ5XgmmWjA","RedLetterMedia","24","20.03.03","redlettermedia|red letter media|red|letter|media|plinkett|half in the bag|mike stoklasa|jay bauman|rich evans|star wars|rise of skywalker|palpatine","441194","30770","213","3274","https://i.ytimg.com/vi/MiqElS_RfPw/default.jpg","False","False","It has been revealed that Palpatine in Rise of Skywalker was a clone. Many people have credited Mike for saying this was the case. He did say it, but not exactly. Let's set the record straight..."
"eVmQDR4vKRM","Spike in coronavirus cases and fatalities around the world","2020-03-02T02:28:01.000Z","UCBi2mrWuNuyYy4gbM6fU18Q","ABC News","25","20.03.03","coronavirus|fatalities|covid-19|washington|state|research|infecting|world|news|wnt|abc|p_cmsid=2494279|p_vid=news-69326714","585090","6268","608","5171","https://i.ytimg.com/vi/eVmQDR4vKRM/default.jpg","False","False","Researchers believe COVID-19 has been infecting people in Washington state for weeks.WATCH THE FULL EPISODES OF 'WORLD NEWS TONIGHT':https://bit.ly/35ZFVjmWATCH OTHER FULL EPISODES OF WORLD NEWS TONIGHT:http://abc.go.com/shows/world-news-tonightWATCH WORLD NEWS TONIGHT ON HULU:https://hulu.tv/33iKepm#WorldNewsTonight #Coronavirus #COVID-19 #Washington"
"0hMdQAjy43A","Walmart's $250 laptop is AWESOME!","2020-03-01T20:00:05.000Z","UCXuqSBlHAE6Xw-yeJA0Tunw","Linus Tech Tips","28","20.03.03","ryzen|3600x|radeon|vega|vega 3|graphics|thin and light|laptop|aluminum|performance|motile|thx|windows|windows hello|cheap|affordable|bargain|budget|1080p|IPS|NVME|SSD|FHD|M141|14","1112257","50403","1025","3704","https://i.ytimg.com/vi/0hMdQAjy43A/default.jpg","False","False","Get a 15-day free trial for unlimited backup at https://backblaze.com/LTTGet an unrestricted 30-day free trial of FreshBooks at https://www.freshbooks.com/techtipsWalmart made a Ryzen laptop and … it's actually not terrible? For $250 how much can you expect to get? Well, more than you would expect, actually - This baby's pretty well equipped for the bargain price! Buy MOTILE 14 Performance Laptop at Walmart: https://geni.us/eAxsBL4Purchases made through some store links may provide some compensation to Linus Media Group.Discuss on the forum: https://linustechtips.com/main/topic/1160836-walmarts-250-laptop-is-awesome/Our Affiliates, Referral Programs, and Sponsors: https://lmg.gg/sponsors'Get Private Internet Access VPN at https://lmg.gg/pialinus2Get a Displate Metal Print at https://lmg.gg/displatelttGet a 30-day free trial of Amazon Prime at https://lmg.gg/8KV1vGet a 15-day free trial for Backblaze at https://backblaze.com/LTTLinus Tech Tips merchandise at http://www.LTTStore.com/ Our Test Benches on Amazon: https://www.amazon.com/shop/linustechtips Our production gear: http://geni.us/cvOSCome see us at LTX 2020: https://www.ltxexpo.com/Twitter - https://twitter.com/linustechFacebook - http://www.facebook.com/LinusTechInstagram - https://www.instagram.com/linustechTwitch - https://www.twitch.tv/linustech Intro Screen Music Credit:Title: Laszlo - SupernovaVideo Link: https://www.youtube.com/watch?v=PKfxmFU3lWYiTunes Download Link: https://itunes.apple.com/us/album/supernova/id936805712Artist Link: https://soundcloud.com/laszlomusicOutro Screen Music Credit: Approaching Nirvana - Sugar High http://www.youtube.com/approachingnirvana"
"Hyhg4MWLgUI","Exposing the BIGGEST Magic Trick Secrets !","2020-03-01T18:23:34.000Z","UCzeB_0FNcPIyUSjL_TL5lEw","AzzyLand","24","20.03.03","azzyland|reaction|reacting|funny|exposing|the|biggest|magic|trick|secrets|sleight|of|hand|illusion|optical illusion|sleight of hand|magic trick revealed|magic trick exposed","334289","11998","907","1988","https://i.ytimg.com/vi/Hyhg4MWLgUI/default.jpg","False","False","Azzyland - Exposing the BIGGEST Magic Trick Secrets - Some of these magic tricks are crazy. Many of them are just sleight of hand and optical illusions but trust me - it is mindblowing ! Can you figure out these magic tricks before they get revealed ? 👨‍👩‍👧 SUBSCRIBE and become part of the AzzyLand family :D ✨ SOCIAL MEDIA•Instagram: https://www.instagram.com/azzyland/•Twitter: https://twitter.com/AzzyLand•Facebook: https://www.facebook.com/azzyland/•Twitch: https://www.twitch.tv/azzyland🎵 OUTRO SONGhttps://www.youtube.com/watch?v=xVzeZGRZk0s"
