video_id,title,publishedAt,channelId,channelTitle,categoryId,trending_date,tags,view_count,likes,dislikes,comment_count,thumbnail_link,comments_disabled,ratings_disabled,description
"O1Ej9NdHscQ","ШОКИРУЮЩАЯ СТАТИСТИКА МЕССИ в матче против РЕАЛА! РЕАЛ - БАРСЕЛОНА 2:0!","2020-03-02T11:34:30.000Z","UCDgbPUAqQlbz5LE_Q0JRBgA","Инсайд Новости Футбола","17","20.03.03","реал|барселона|реал барселона|реал мадрид|барса|реал мадрид барселона|реал барса|реал мадрид барса|реал барселона 2 0|реал мадрид барселона 2 0|реал барса 2 0|реал мадрид барса 2 0|винисиус|гол винисиуса|мариано|гол мариано|месси|реал барселона обзор|реал барселона обзор матча|реал мадрид барселона обзор|реал мадрид барселона обзор матча|реал барселона 2020|реал мадрид барселона 2020|реал мадрид барселона 2 0 обзор матч 2020|инсайд|новости футбола|футбол","58881","5146","115","484","https://i.ytimg.com/vi/O1Ej9NdHscQ/default.jpg","False","False","ШОКИРУЮЩАЯ СТАТИСТИКА МЕССИ в матче против РЕАЛА! РЕАЛ - БАРСЕЛОНА 2:0!🔔 ПОДПИСЫВАЙСЯ на ИНСАЙД ➤ https://goo.gl/Q2WRSm🔺Наш инстаграм ➤ https://www.instagram.com/inside__rus🔺Мир трансферов ➤ https://www.instagram.com/inside_transfers/Всем привет! Ух какое зрелище нам подарило Эль Класико! В отличие от декабрьского матча, на сей раз есть что обсудить! Поэтому не смеем задерживать! Друзья, пишите в комментарии лучшего и худшего игрока матча, ну а мы начинаем с новостей одной строкой!#месси #реалбарселона #класико #реал #барселона #инсайд #новостифутбола"
"U9kqDRkXtYM","Рабинович ударил по фашистам 02.03.20","2020-03-02T10:53:20.000Z","UC9oI0Du20oMOlzsLDTQGfug","NEWSONE","25","20.03.03","ньюс ван|прямой эфир|newsone|украина|онлайн|новости|последние новости|новости украина|верховна рада|парламент|уряд|смотреть ньюс ван|новости онлайн|вадим рабинович|оппозиционная платформа - за жизнь|рабинович новое|рабинович последнее|рабинович ютуб|рабинович видео|рабинович онлайн|оппозиционная платформа за жизнь|вадим рабинович последнее|рабинович о зеленском|рабинович о слуге народа|рабинович о политике|рабинович политик","114552","8198","167","1478","https://i.ytimg.com/vi/U9kqDRkXtYM/default.jpg","False","False","Вадим Рабинович, народный депутат, сопредседатель партии «Оппозиционная платформа — За жизнь» на Согласительном совете.Посмотрели видео, но не подписаны на наш канал? Чтобы не пропустить важные новости, нажимайте сюда: http://bit.ly/NEWSONE• Прямой эфир NEWSONE: https://youtu.be/3e0FsU1N6OQ• Горячие новости: http://bit.ly/2uO95ly• «Украинский формат»: http://bit.ly/2HXLNlP• «Эпицентр украинской политики» с Пиховшеком: http://bit.ly/2TYsPNl• «Пятый угол» с Пиховшеком и Панченко: http://bit.ly/2G1bway• «Тема» с Панченко: http://bit.ly/2K8ZuQM• «Противостояние»: http://bit.ly/2YQqBTP• «Радар»: http://bit.ly/2TZwcUa• «Политика здоровья» с Шевчук: http://bit.ly/2YOonnT• «Я так думаю» с Коцабой: http://bit.ly/2G0LVhW• LIVE с Кирик: http://bit.ly/2CXM5Vm• Драки, скандалы и ссоры: http://bit.ly/HiJHSDF• Остальные программы: http://bit.ly/2ONVIe0NEWSONE — ведущий украинский информационный телеканал. 100% эфира обеспечивается собственным производством телеканала.С помощью уникальной системы live U мы ведем трансляции непосредственно с места события и оперативно освещаем самые свежие новости и события Украины и мира, предоставляем широкий спектр мнений экспертов.NEWSONE занимает лидирующие позиции по показателям смотрения информационных каналов Украины как в традиционном телевидении, так и в Интернете.Смотрите прямой эфир, присоединяйтесь к обсуждениям в социальных сетях и будьте всегда в курсе последних горячих новостей! Политика, экономика, спорт, интервью, специальные репортажи, происшествия, выступления политиков — все это есть у нас!• сайт: https://newsone.ua • Facebook: https://fb.me/newsone.ua #Украина #новости #политика"
"Uz59f8gT244","ЗАПЕЧЕННЫЙ ЯГНЕНОК в САМОДЕЛЬНОМ ТАНДЫРЕ. ENG SUB.","2020-03-01T08:51:36.000Z","UCHK357UDDmL6EMTb4YPE7ew","GEORGY KAVKAZ","24","20.03.03","запеченный|как|rfr|запечь|рецепт|запеченной|запеченная|в|духовке|рецепты|сколько|запекать|мясо|картошка|картофель|курица|рыба|запечен|целиком|запеченные|овощи|свинина|фольга|духовка|сыр|вкусные|грудка|вкусно|филе|калорийность|баранина|шурпа|из|приготовить|суп|баранины|тушеная|с|овощами|блюда|шашлык|без|какое|купить|ели|домашнее|маринад|быстрый|молочный|ягненок|молчание ягнят|тандыр|тандыре|русская печь|своими руками|самодельный|сделать|самодельном|самодельные|георгий кавказ|YouTube","1350799","75565","2104","8129","https://i.ytimg.com/vi/Uz59f8gT244/default.jpg","False","False","Как приготовить ягненка в самодельном тандыре. Вкусные рецепты на канале Георгий Кавказ в YouTube. Шашлык из барана. Новое видео ЗАПЕЧЕННЫЙ ЯГНЕНОК в САМОДЕЛЬНОМ ТАНДЫРЕ. ENG SUB.https://youtu.be/Uz59f8gT244_________________Друзья поддержите видео лайком! РОЗЫГРЫШ ПРОХОДИТ НА НАШЕЙ СТРАНИЦЕ ИНСТАГРАМ https:https://www.instagram.com/georgikavkaz/-----------------------------Группа Вконтакте:  https://vk.com/public153068131-----------------------------Заказать сыр можно здесь https://from-zhukovka.ru----------------------------P.s. ПОНРАВИЛОСЬ ВИДЕО ПОДЕЛИСЬ С ДРУГОМ!#ЗАПЕЧЕННЫЙ #ЯГНЕНОК #ТАНДЫР"
"H41BwjQ7k64","Реакция на гол Мариано в матче Реал Мадрид - Барселона 2:0 | Как Зидан должен поступить с Мариано?","2020-03-02T11:00:06.000Z","UCh2njy1jDqbM0P4rT6xWwhg","ZZone/Реал Мадрид","17","20.03.03","Реал Барселона 2:0|Реал Мадрид Барселона|Real Madrid Barcelona|Мариано гол|Мариано Реал|Мариано Барселона|Mariano Barcelona|моя реакция|my reaction|чемпионат Испании|Зинедин Зидан|Лука Йович|Карим Бензема|ZZone/Реал Мадрид|Z Zone|з зон|Зураб Тодуа","28396","3769","92","248","https://i.ytimg.com/vi/H41BwjQ7k64/default.jpg","False","False","Мариано забил второй гол в матче Реал Мадрид - Барселона (2:0), тем самым закрепив победу сливочных. О конкуренции с Йовичем и несправедливом отношении Зидана - в новом видео на на Z Zone. Вы на лучшем канале о клубе Реал Мадрид на русском языке, где обсуждается не только команда, но и последние новости футбола.------------------------По вопросам рекламы и сотрудничества: https://vk.com/id134557774------------------------ПАБЛИК Z ZONE в VK: https://vk.com/zzone7------------------------Мой Instagram: https://www.instagram.com/zzonerm/#РеалМадрид #РеалБарселона #Мариано #RealMadrid #ZZone"
"IXZpKlJ4fCM","РАЗДЕТЬСЯ ЗА 5 МИНУТ И ОНИ ТВОИ - ЛЕГКИЕ ДЕНЬГИ!","2020-03-02T10:00:06.000Z","UC7kOYgalsaI79K_aN9YYj9w","МАКАРОВ","24","20.03.03","Раздеться|за 5 минут|они твои|легкие деньги|деньги за 5 минут|раздеваю за деньги|в машине за 5 минут|легкие деньги в тачке|деньги твои|транспорт|новое|Саратов|на что готовы|готовы ради денег|они готовы раздеваться|девушка и парень|деньги в машине|что сделает девушка ради денег|развлечение|тачка|тачка или деньги|девушка или машина|Макаров|Сергей Макаров","16859","1347","191","209","https://i.ytimg.com/vi/IXZpKlJ4fCM/default.jpg","False","False","Ну что родные сегодня мы посмотрим разденется девушка за 4550 рублей. Ваше мнение для меня важно. Напишите комментарий и поставь лайк. Все комментарии читаю Instagram:https://www.instagram.com/makarovmss Instagram:https://www.instagram.com/makarovchannelTelegram: https://teleg.one/joinchat/AAAAAE0du3mJB7gcDUQU9AВконтакте:https://vk.com/makarov_offГруппа вконтакте:https://vk.com/makarovchannel"
"7wQLTxfmmvU","смерть синего пса ФЕЙК","2020-03-02T10:10:40.000Z","UCa6tgGpdVhsrQVd4hkoh7TQ","Septie","1","20.03.03","Септи|синий пес|Септи и синий пес|смерть синего пса|septie|meme|animated","15251","3777","75","340","https://i.ytimg.com/vi/7wQLTxfmmvU/default.jpg","False","False","Расскажи мне, как ты плакал над Хатико...Просто мини-скетч 🌚 для разнообразия. Пойду рисовать для вас слияние ос чтолеСпасибо за внимание :3 Ах да, дорогие друзья, я открываю новую группу в вк... для лиц старше 18 лет. 🌚🌚🌚 Группа платная. Кого заинтересует, переходите по ссылке ниже в мой паблик. Следите за новостями. Группу откроем уже сегодня. Если что-то интересует, пишите мне в лс ^^ ПокаВот ссылки на мои странички в соцсетях :ВК : https://vk.com/dom_pepticaПаблик в вк: https://vk.com/septie_hochet_kushat171422553Twitter: https://mobile.twitter.com/Septie_mlp_fnafInstagram : https://www.instagram.com/mlpfnaflps_septie/"
"FObg_5ywNGk","Россия ответила США на блoкaдy Kpыма","2020-03-02T07:52:04.000Z","UCW2otexgu1x1OSySfmJf0kA","Суть Вещей","29","20.03.03","Россия ответила США|Россия|ответила|США|Россия и партнеры|России и США|исторические события|новости события факты|политические события|новости политики|геополитика|события в истории|политика|Суть вещей|cenm dtotq|SutiVeshey|суть вещей новое|суть вещей видео","99756","4871","118","558","https://i.ytimg.com/vi/FObg_5ywNGk/default.jpg","False","False","Россия ответила США на блoкaдy Kpымa Источник: https://clck.ru/HzTA4══════════════════════════════════Плейлист этого видео: Россия и партнеры -  https://www.youtube.com/playlist?list=PLheqqLmZvu7FuIfRAn_u5OdHaKpMEACP6 ============================================Хотите заказать РЕКЛАМУ на канале Суть Вещей? Пишите на ПОЧТУ  sutiveshey@gmail.com═══════════════════════════════════Музыка была взята из бесплатной библиотеки ютуб.#СутьВещей #Россия #США"
"rj5W_dbBELw","Семья приютила бездомного старика... И вот кем он оказался и как их отблагодарил за добро...","2020-03-01T14:45:43.000Z","UCfMB30UnkgmIyczPJgL88Mg","Удивительные Истории","24","20.03.03","истории любви до слез|истории из жизни|жизненные истории|реальные истории|истории любви реальные|истории любви из жизни|истории любви|отношения любовь|про любовь|любовные истории|короткие истории любви|удивительные истории|интересные истории|поучительные истории","198917","5228","304","117","https://i.ytimg.com/vi/rj5W_dbBELw/default.jpg","False","False","Семья приютила бездомного старика... И вот кем он оказался и как их отблагодарил за добро...#историилюбви  #поучительныеистории #историилюбвидослез #грустныеисториилюбви #реальнаяистория #жизненныеистории  #историяизжизни"
"IEJoPeQ6C0k","ОПА ОПА! БИШКЕКТЕ УШУНДАЙ ЫЗЫ ЧУУ ЧЫГЫП КЕТТИ ЭЛ ТОПТОЛУП!","2020-03-02T07:57:09.000Z","UCS0aMpbDp8B0875RTsenrLw","Жанылыктар Топтому","25","20.03.03","[none]","101651","2786","145","583","https://i.ytimg.com/vi/IEJoPeQ6C0k/default.jpg","False","False","наша группа в вк https://vk.com/bozzzotv"
"2mz2YlGm2dA","БЛОГЕР  ДИДЕНКО ОТРАВИЛА ТРОИХ / МЕЖДУ НАМИ ТАЕТ ЛЕД","2020-03-01T12:11:12.000Z","UCg0Y6Q0m3A_5X0CPY-IG3Yg","Veronika Stepanova","22","20.03.03","[none]","252134","13358","3545","4820","https://i.ytimg.com/vi/2mz2YlGm2dA/default.jpg","False","False","#сухойледвбассейне"
"8nkllSQOUvQ","Увеличиваем приятие для богатства. Александр Палиенко.","2020-03-02T04:00:01.000Z","UCjU6rOqN9EikKJfuHSTxFbQ","Александр Палиенко","22","20.03.03","Палиенко|Александр Палиенко|эзотерика|тренинги|лекции|цитаты|развитие|счастье|семинар|встреча|вебинар|саморазвитие|любовь|отношения|мужчина|женщина|практики|бизнес|энергия|гармония|духовность|целостность|учение|вегетарианство|религия|Увеличиваем приятие для богатства|богатство|приятие|улучшать|как","36461","4391","28","204","https://i.ytimg.com/vi/8nkllSQOUvQ/default.jpg","False","False","Увеличиваем приятие для богатства – фрагмент записи встречи с Александром Палиенко.Для получения закрытого контента переходите по ссылке https://www.youtube.com/APalienko/join и становитесь спонсорами.Каждый понедельник и пятницу новое видео. Подписывайтесь, чтобы первыми смотреть новые видео.--Все официальные видео от Александра Палиенко в одном плейлисте: http://www.apalienko.com/ytp.htmlСайт - https://APalienko.comTelegram - http://APalienko.com/telegramЧат - https://APalienko.com/telegram-chatTelegtam Латвия - https://t.me/apalienkolatvijaFacebook - https://APalienko.com/fbInstagram - https://APalienko.com/inInstagram English - https://www.instagram.com/alexanderpalienko.official#Палиенко #Alexander_Palienko #Александр_Палиенко"
"2qALTo5B5So","Гелики, БМВ и Порше с АЛИЭКСПРЕСС за $3000: атака клонов из Китая!","2020-03-02T08:05:33.000Z","UCSU6G0iZ5MI7bIM8pTl_kaw","ПриветТачка","2","20.03.03","привет тачка|дорого богато|дорого-богато|обзор|авто|тачка|алибаба|alibaba|алик|алиэкспресс|aliexpress|алиэкспресс товары|алиэкспресс халява|алибаба сайт|фейк|fake|подделка|китайский автомобиль|китайский автопром|китайский авто|китай|сделано в китае|мерседес|mercedes|оригинал|сравнение|распаковка|анпакинг|товары с алиэкспресс|товары с aliexpress|товары из китая|посылка с китая|посылка|china|али|китаец|покупки с алиэкспресс|pandao|пандао|автомобиль|из китая","64078","4357","355","206","https://i.ytimg.com/vi/2qALTo5B5So/default.jpg","False","False","❗Наш мерч теперь доступнее, чем когда-либо!Заходи и смотри ➡ http://www.privettachka.com ☎️ РАЗМЕСТИТЬ РЕКЛАМУ/ДАТЬ МАШИНУ НА ОБЗОР: pr@rumonkey.ru👁️ НОВОСТИ КАНАЛА, СТРИМЫ, ЭКСКЛЮЗИВЫ: https://www.instagram.com/privettachka/ ХОЗЯЙКЕ НА ЗАМЕТКУ: Наши тексты на Драйве https://www.drive2.ru/users/privettachka/Наши ролики раньше Ютуба на МегаФон ТВ http://bit.ly/2Ym69K2 Инста Кирилла https://www.instagram.com/bazilier/Инста Жутикова https://www.instagram.com/zhutikoff/ Инста Фролова https://www.instagram.com/il.frolov/========= P.S. В ЭТОМ ВЫПУСКЕ =========Мы зашли на Алибаба (Alibaba) и Алиэкспресс (Aliexpress) и посмотрели всю паль MADE IN CHINA. Только в этом выпуске фейковые Гелендваген (Mercedes G-Class), Порше Каен (Porsche Cayenne), BMW, суперкары Ауди (Audi R8) и даже Бугатти + другая дичь с Алика. Добро пожаловать в мир премиальной дичи - мы снова распаковываем товары из Китая!"
"Ldx0YRO7vM8","01.03.2020 Сочи - Арсенал - 1:2. Обзор матча","2020-03-01T18:28:04.000Z","UCtetJiD_llxdGL4Uh5-Oe2w","Матч ТВ","17","20.03.03","Матч ТВ|Спорт|Все на Матч|Матч|sp:ty=high|sp:dt=2020-03-01T16:00:00Z|sp:st=soccer|sp:li=russ|sp:ti:home=DIN|sp:ti:away=FCAT|Футбол|Гол|Обзор|Болельщик|РПЛ|Чемпионат|России|сочи|арсенал","231623","4419","164","863","https://i.ytimg.com/vi/Ldx0YRO7vM8/default.jpg","False","False","Статистика матча: https://news.sportbox.ru/Vidy_sporta/Futbol/Russia/premier_league/stats/turnir_16005/game_1380704050Подписаться на канал: https://www.youtube.com/channel/UCtetJiD_llxdGL4Uh5-Oe2w?sub_confirmation=1Чтобы получать уведомления о новых видео, жмите на колокольчик!Больше видео с лучшими моментами матчей на нашем официальном сайте: https://matchpremier.ru/ МАТЧ ПРЕМЬЕР в соцсетях:ВКОНТАКТЕ: https://vk.com/matchpremierFACEBOOK: https://www.facebook.com/matchpremier/TWITTER: https://twitter.com/matchpremierINSTAGRAM: https://www.instagram.com/matchpremier/ОДНОКЛАССНИКИ: https://ok.ru/matchpremierСкачивайте официальное приложение МАТЧ!:IOS: https://itunes.apple.com/app/apple-store/id1051293689?mt=8ANDROID: https://play.google.com/store/apps/details?id=com.tviztv.tviz2x45&referrer=utm_source%3DMatchTVinVKФото анонса: ПФК «Арсенал»"
"cmvzVa1NBRk","Наставление на Великий Пост. Протоиерей  Андрей Ткачёв.","2020-03-01T16:16:45.000Z","UCiXFDtLgmHpSbZ8rjk_TJtQ","Протоиерей Андрей Ткачёв","22","20.03.03","отец Андрей Ткачев|Андрей Ткачев|Andrey Tkachev|РПЦ|патриарх|Jesus Christ|Воскресение|семья|блуд|молодость|Великий Пост|христианство|молитва|Христос Воскрес","101568","0","0","497","https://i.ytimg.com/vi/cmvzVa1NBRk/default.jpg","False","True","Каналы отца Андрея в соцсетях:instagram - https://www.instagram.com/andreytkachev_official/Группа VK - https://vk.com/andreytkachevcomМы в Facebook - https://www.facebook.com/andreytkachevcomМы в Одноклассниках - https://ok.ru/group/55093972762870/По вопросам сотрудничества на Ютуб : o.andreitkachev@gmail.com"
