video_id,title,publishedAt,channelId,channelTitle,categoryId,trending_date,tags,view_count,likes,dislikes,comment_count,thumbnail_link,comments_disabled,ratings_disabled,description
"H7HGKzTGO2M","Виктория Исакова: о возрасте, дочке, цинизме актёрской профессии и революции // А поговорить?...","2020-03-02T08:20:41.000Z","UCp2J7GRxQ36QLqW4ReLLt5g","А поговорить?","22","20.03.03","исакова|виктория исакова|виктории исаковой|дочь виктории исаковой|исакова актриса|а поговорить|шихман|ирина шихман|исакова шихман|интервью|виктория исакова фильмы|фото исаковой|скажи правду|операция сатана|оптимисты|зорге|демон революции|родина|инквизитор|русский бес|эпидемия|один вдох|актерская профессия|очень женские истории|звезда|российское кино|кино|звезда кино|апоговорить|собчак|осторожно собчак|лойк|никита лойк|режик|интервью дудя|шоу|музыка","151687","6473","544","1042","https://i.ytimg.com/vi/H7HGKzTGO2M/default.jpg","False","False","Вся мебель на сайте http://mnogomebeli.com От меня бонус 1000р по промокоду ПОГОВОРИТЬ!Одежда ведущей: https://instagram.com/belbazar24?igshid=tx3boyxjoj0khttps://instagram.com/nearlynakedshoes?igshid=kaz510seo0nxИнтервью Виктории Исаковой Ирине Шихман. Виктория Исакова - звезда российского кино. Она снималась в последних премьерах: Скажи правду, Операция Саната, Оптимисты, Оттепель, Зорге, Один вдох, Эпидемия, Очень женские истории и многие другие.Место: «Omega Rooftop» – площадка для проведения мероприятий на крыше универмага «Цветной».Сайт https://omegarooftop.ru/ Facebook - https://www.facebook.com/omegarooftop/Ирина Шихман берет эксклюзивные интервью у самых неожиданных гостей! А поговорить?..НАМ РАССКАЖУТ ВСЕ!#исакова #шихман #апоговорить #интервьюПодпишись на канал https://www.youtube.com/channel/UCp2J7GRxQ36QLqW4ReLLt5g?sub_confirmation=1Instagram Ирины Шихман: https://www.instagram.com/irinashikhman/За логотипом и фирменным стилем к Борису Казачкову https://www.instagram.com/boris.kazachkov/Смотри также:Fake? - https://www.youtube.com/channel/UCjGlgbbxwKSiDdoXciEKNaw?sub_confirmation=1Омар в большом городе - https://www.youtube.com/channel/UCvWyORw4cu6FdqCO9OM83xg?sub_confirmation=1Фанимани - https://www.youtube.com/channel/UCNY3HHVKy6LdpgUcDquXgTw??sub_confirmation=1"
"nCfmi4i-K8s","01.03.2020 Тоттенхэм Хотспур — Вулверхэмптон. Обзор матча","2020-03-01T18:58:28.000Z","UChRptIBYItIqMBbKv6B9WEw","PRO Английский футбол","17","20.03.03","футбол|АПЛ|Чемпионат Англии|Premier League|Тоттенхэм Хотспур|Вулверхэмптон|Tottenham Hotspur|Wolverhampton Wanderers|Стивен Бергвейн|Мэтт Доэрти|Серж Орье|Диогу Жота|Рауль Хименес|Steven Bergwijn|Serge Aurier|Matt Doherty|Diogo Jota|Raul Jimenez|sp:ty=high|sp:dt=2020-03-01T14:00:00Z|sp:st=soccer|sp:li=epl|sp:ti:home=TOT|sp:ti:away=WAND","252405","6693","125","487","https://i.ytimg.com/vi/nCfmi4i-K8s/default.jpg","False","False","Предлагаем посмотреть видеообзор матча «Тоттенхэм Хотспур» — «Вулверхэмптон», который состоялся 1 марта 2020 года в рамках 28-го тура Английской футбольной Премьер-лиги.В хайлайте вы увидите: гол Стивена Бергвейна, гол Мэтта Доэрти, гол Сержа Орье, гол Диогу Жота, гол Рауля Хименеса.Полная запись матча: https://okko.sport/game/tot-wol-epl19?utm_medium=social&utm_source=youtube&utm_campaign=obzorПолная статистика матча: https://www.championat.com/football/_england/tournament/2995/match/775971/#statsОформить подписку на одну неделю Английской премьер-лиги можно всего лишь за 1 рубль. Также доступны подписка на сутки, месяц или на оставшуюся часть сезона. Подробнее на сайте Okko Спорт: https://vk.cc/9Sp3uw Мы ВКонтакте: https://vk.com/proeplМы в Телеграме: https://t.me/proEPLМы в Твиттере: https://twitter.com/proepl"
"MqCZS7Amvp8","Siren 2. Ужасный сиквел с запутанным сюжетом [Страшно, вырубай!]","2020-03-02T07:28:48.000Z","UCq7JZ8ATgQWeu6sDM1czjhg","StopGame.Ru","20","20.03.03","stopgame|стопгейм|страшно вырубай|хорроры|игры ужастики|survival horror|зловещая долина|uncanny valley|silent hill|обзор|геймплей|говард филипс лавкрафт|мифы ктулху|утопия шоу|лавкрафт в играх|ктулху в играх|лавкрафтианский ужас|Cthulhu|кошмары интернета|Siren|Siren разбор|sony|playstation|Siren концовки|Forbidden Siren|запретная сирена|Silent Hill разбор|Silent Hill история серии|siren история серии|сиквел|Siren 2|Forbidden Siren 2|сирена 2","82765","10355","172","414","https://i.ytimg.com/vi/MqCZS7Amvp8/default.jpg","False","False","• Комментарии и обсуждения — https://stopgame.ru/show/107998/siren_2• Ещё больше об играх — http://bit.ly/StopGame-SUB • Первая часть истории — https://stopgame.ru/show/107274/siren_velikiy_horror_proshedshiy_nezametno_strashno_vyrubayКогда оригинальные идеи не находят положительного отклика у публики, то от них стараются отказаться. Но Кейчиро Тояма решил, что надо просто прислушаться ко всей критике и постараться сделать большую работу над ошибками, при этом не отказываясь от выбранного ранее пути. Так на свет и появилась Forbidden Siren 2, о которой сегодня мы подробно поговорим.***Расписание эфиров — https://stopgame.ru/live_scheduleВсе записи трансляций — https://stopgame.ru/live/newИгры на StopGame.ru — https://stopgame.ruФутболки от StopGame — https://goo.gl/eYmQG9Мы ВКонтакте — https://goo.gl/ACHwpTМы в Steam — https://goo.gl/3BQAlBМы в Facebook — https://goo.gl/1oAoU4Мы в Twitter — https://goo.gl/JYy7C4Мы в Telegram — https://goo.gl/VgqMn2Мы в Instagram — https://goo.gl/e8rQ1DНаши переводы и озвучки — https://goo.gl/szwPNEПрямые трансляции на YouTube — https://goo.gl/9N311NПрямые трансляции на Twitch — https://goo.gl/fmd5LY"
"-5FNkxp4uyQ","Миннесота - Вашингтон: 2 марта 2020, Обзор матча...","2020-03-02T04:26:05.000Z","UCWwCM3cvQjiAecvkph7EyCQ","vlad pergler","17","20.03.03","обзор нхл матчей 2019-20|обзор нхл|обзор нхл сегодня|обзор нхл матчей|обзор нхл 17-18|прогнозы нхл","141622","2476","77","359","https://i.ytimg.com/vi/-5FNkxp4uyQ/default.jpg","False","False","Washington Capitals vs Minnesota Wild,НХЛ, 2 марта 2020, Xcel Energy CenterГлавные судьи Фрэнсис Шэррон, Ти-Джей ЛаксморЛайнсмены Брайан Мерфи, Брайан МачМиннесота-3 Донато (Сутер)13 Фиала (Хант, Сперджен)52 Паризе (Фиала)Вашингтон-7 Овечкин ( Бэкстрем, Карлсон)10 Паник (Хагелин)10 Овечкин (Ковальчук, Кузнецов)40 Уилсон (Кузнецов, Овечкин)Что бы поблагодарить автора, переходи по ссылке https://money.yandex.ru/to/410011985422663"
"AfErocn_5n0","Психолог о Екатерине Диденко: «сухой лёд в бассейн» вызвал ПТСР у блогера","2020-03-02T06:01:55.000Z","UCu_sa2ZIHKkr5IXqUe7_VpQ","Телеканал 360","22","20.03.03","сухой лед|сухой лёд в бассейн|екатерина диденко|диденко екатерина|блогер диденко|сухой лёд диденко|екатерина диденко сухой лёд в бассейн|9 вал|бассейн|соцсети|инстаграм|подписчики|сухой лёд|эксперимент|эксперименты|что будет если|эксперименты с сухим льдом|лед|опыты|опыты с сухим льдом|360tvru|телеканал 360|новости|канал 360|360 подмосковье|новости сегодня|новости россии сегодня|новости в россии|последние новости|новости 360","43603","274","574","470","https://i.ytimg.com/vi/AfErocn_5n0/default.jpg","False","False","Убитая горем Диденко по-прежнему шокирует пользователей соцсети. Она переживает своё горе онлайн. Девушка регулярно делает видеопосты на своей странице, при этом свои рассказы о трагедии она сопровождает бьютифильтрами и просит подписчиков найти ей хорошего психолога. В каждом сторис – надрыв и много слез. Своим горем Диденко щедро делиться с подписчиками. За сутки их у блогера стало на полмиллиона больше. Но многие такую откровенность в сети не одобряют и обвиняют девушку в неправильной реакции на смерть близкого человека. Подпишитесь на канал 360: https://www.youtube.com/360tvru?sub_confirmation=1 #360новости #диденко #блогер #савичева #екатеринадиденко #сухойлёдПодпишись на нас:✅Telegram -  https://tele.gg/tv360ru✅Instagram - https://www.instagram.com/mbn360tv/✅TikTok - https://www.tiktok.com/@360tv✅VК - https://vk.com/tv360✅FB - https://www.facebook.com/tv360/?fref=ts✅ОК -  https://ok.ru/tv360✅Twitter - https://twitter.com/360tvПриложение 360 Android: https://play.google.com/store/apps/details?id=ru.tv360.mobile.androidПриложение 360 iOS:  http://social.360tv.ru/SPUWПоследние новости - https://www.youtube.com/playlist?list=PLKlOceUfsEcxmgPap_a80MmCmazqkewUnГлавное видео дня - https://www.youtube.com/playlist?list=PLKlOceUfsEcwL3VwCgOWDlEAuEuF00VrsЛучшие истории - https://www.youtube.com/playlist?list=PLKlOceUfsEcyWlGN841OZdBJysV5ioaMfПроисшествия - https://www.youtube.com/watch?v=6FON2_FNbsI&amp;list=PLKlOceUfsEcwBhu7bdZhyLBG72MzIWFBl#кириллалексеев #бригадаураган  #екатеринасафронова"
"1BpsMeOj-QU","ВД №216 Злобные глиномесы Некрасовки","2020-03-02T05:00:14.000Z","UC5DWMy_XjL3v3VfLIZFZvpw","Движение","2","20.03.03","дпс|мвд|гибдд|полиция|орел|филин|барсяка|регламент|идпс|гаи|движение|вектор|Москва|Россия|чоп|запрет|фото|видео|Некрасовка|ВАО|ездуны по газонам|объезд пробки|воруем время|кКонченые ублюдки Некрасовки|Некрасовка мой район|Стальные джунгли|Григорий|Жив Цел Орёл|Барсяка жжот|ДПС ВАО","117840","6002","470","1067","https://i.ytimg.com/vi/1BpsMeOj-QU/default.jpg","False","False","https://clck.ru/MBxb8 ⟵ Жми на ссылку, не бойся! В нашей стране каждый может попасть в неприятности. Нас обманывают повсеместно. Никому не стоит верить на слово. В магазине впарят просрочку, в банке кредит с конским процентом, сосед затопит, учитель наорет на ребёнка. Справедливости уже давно нет. Призвать к порядку и восстановить справедливость самому законными методами нереально. Не надо мириться с произволом вокруг. Опытные юристы из компании Современная Защита - защитники, которым можно доверять!Они обещают и делают, и не берут на себя не исполнимых обязательств. Таких юристов в наши дни, очень тяжело найти. Все их услуги прозрачны, без подводных камней и скрытых платежей.-----------------------------------------------------Некрасовка. Новый район Москвы, выросший вокруг старой помойки (кстати, одной из самых больших свалок возле Москвы, 17,5 га). Проектируемый проезд №598, около новой станции метро Лухмановская. Чудный газон вдоль метрогородка этой зимой стал полигоном для негодяев, объезжающих утреннюю пробку (хотя пути объезда есть). Местные жители, ненавидящие беспредел и подлость соседей, прислали нам несколько видео с этого места, и мы незамедлительно выехали на рейд. И действительно, проблема есть. Маршрутки, легковушки, и даже грузовики (а точнее водители этих машин) считают себя вправе украсть время у односельчан, прокатившись по газону, внесённому на кадастровую карту (77:03:0010010:1002). Мы попытались застыдить водителей-нарушителей, даже с помощью местного ДПС, но там нужно вводить более радикальные меры...------------------------------------------------------Передаём привет и пожелания скорейшего выздоровления Андрею Барсяке, который проводил этот рейд и смонтировал это видео. Вчера у него обнаружились симптомы, схожие с симптомами коронавируса 2019-nCoV. Надеемся, диагноз не подтвердится.-----------------------------------------------------Канал Григория Стальные джунгли: https://www.youtube.com/channel/UCYQFt279ThOXBSs6vWowTZQ-----------------------------------------------------Канал Движение разрешает автору канала Стальные джунгли использовать часть контента с нашего канала, из совместно проведённых рейдов, в своих видео.----------------------------------------------------Подписывайтесь на канал Движение Трэвел: https://www.youtube.com/channel/UCyARl31VTWxQ-WFTQVuUAfw-=-=-=-=-Наш телеграмм-канал: https://t.me/SilaDvizheniya-=-=-=-=-Друзья, СПАСИБО, что вы присылаете нам фото и видео, после которых мы проводим расследования!))) Ваши материалы можно прислать нам на почту: dvizhenietv@gmail.com-=-=-=-=-Фейсбук: https://www.facebook.com/groups/195887400610773/Вконтакте: https://vk.com/dvizhenietvТвиттер Движения: https://twitter.com/dvizhenietvСайт: http://www.dvizhenie.tv/Контактный телефон: 8-926-139-9391-=-=-=-=-Присылайте ваши идеи, наблюдения за нарушителями, места для рейдов или видео на нашу почту: dvizhenietv@gmail.com-=-=-=-=-Production Music courtesy of Epidemic Sound!-=-=-=-=-Предупреждаем о том, что содержимое данного видео является субъективным мнением авторов а так же сообщений и комментариев и в некоторых случаях может содержать ложную информацию, когда автор не разобрался полностью в ситуации . К сведению подписчиков и зрителей- администрация канала(сайта,страницы) не может проверить достоверность всей размещаемой информации, что необходимо учитывать при ознакомлении и размещении своих комментариев."
"oCxY9rlJzBw","Салат Подснежник вкусный весенний салат | Spring salad recipe","2020-03-02T08:00:04.000Z","UCZEqXoz7G4sPniv_hJJbVhw","Ольга Матвей","22","20.03.03","Салат|Salad (Type Of Dish)|Cooking (Interest)|вкусный|еда|как приготовить|что приготовить|как готовить дома|что приготовить на праздник|что приготовить для гостей|что приготовить на новый год|что приготовить дома|Food (TV Genre)|салаты|рецепты салатов|салат вкусно|вкусные салаты|Salad|recipe|ольга матвей|канал ольга матвей|рецепт|рецепты|кухня|весений салат|салат рецепт|salad|salad recipe|spring salad|рецепт салата|красивый салат","61373","5480","150","220","https://i.ytimg.com/vi/oCxY9rlJzBw/default.jpg","False","False","Приятного аппетита!*************************************** Мой INSTAGRAM: https://www.instagram.com/olga_matvii/ Рецепт Ниже под Видео!!!А Также Плейлисты с Другими Рецептами на Моем Канале!*******************************************НА МОЕМ КАНАЛЕ ЕСТЬ ЕЩЕ МНОГО ВКУСНЫХ РЕЦЕПТОВ.             ПОДПИСЫВАЙТЕСЬ НА МОЙ КАНАЛ:https://goo.gl/gNtayw**************************************Новый Канал о Нашей Жизни. Влог. Подписывайтесь!!!https://goo.gl/f1cXaD******************************************* ПРИСОЕДИНЯЙТЕСЬ В СОЦ СЕТЯХInstagram: https://www.instagram.com/olga_matvii/Яндекс ДЗЕН мой канал: https://zen.yandex.ru/olgamatvey TikTok: https://www.tiktok.com/@olgamatveyКанал в Telegram: https://t.me/OlgaMatveyyОдноклассники:https://ok.ru/group/53507527147713Моя группа ВКонтакте: http://vk.com/public94593369Моя страница в Facebook:    https://www.facebook.com/vkysnueveschi/Сообщество в Google+ https://plus.google.com/u/0/communities/116298370067562231138Twitter: https://twitter.com/Dima111111******************************************************Рецепт:Пекинская капуста 400 грМайонез по вкусуСоль, перец, чеснок Куриная грудка 2 штПомидоры 200 грЯйца отварные 4 штУкроп 50 грСыр 200 грДля украшенияСыр в стиках 4 штМорковь 1 штЧеремша или зеленый лукРепчатый лук 4 луковицыШпажки ************************Recipe:Napa cabbage 400 gMayonnaise to tasteSalt, pepper, garlic2 chicken breast  Tomatoes 200 g4 boiled eggs Dill 50 gCheese 200 gFor decoration:4 stick cheese1 сarrotWild garlic or spring onions4 onionsSkewers**************************************МОИ ПЛЕЙЛИСТЫ:1) Сладкие блюда. Тортики, Десерты и Разные Сладости.  Вы их просто полюбите и будете всегда готовить:https://www.youtube.com/playlist?list=PLtl_gGHV94in3XfP9C8qB-AspLhvoCKmE2) Вторые блюда, этот плейлист посвящен очень вкусным рецептам Вторых блюд и Несладкой выпечке:  https://www.youtube.com/playlist?list=PLtl_gGHV94ikJ707aLNONvIc67N6o_JYz3) Новые Блюда, в этом плейлисте,  я с вами поделюсь новинками : https://www.youtube.com/playlist?list=PLtl_gGHV94im9D4mKjz9fMLxPo4nZKviy4) Салаты - домашние рецепты, лучше вас их никто не приготовит: https://www.youtube.com/playlist?list=PLtl_gGHV94ilj1K9U7Ffs8cnFYya0p9s55) Очень Быстрые и  Простые рецепты, НО ОЧЕНЬ ВКУСНЫЕ (Дешево и сердито) :https://www.youtube.com/playlist?list=PLtl_gGHV94ilg0fSjW27ypipF7eEyMLg06)Рецепты Праздничных Блюд на Новый Год и Рождествоhttps://www.youtube.com/playlist?list=PLtl_gGHV94ikrYgYIgFZjPFa-iFNUK2FN7)Низкокалорийные Рецепты:https://www.youtube.com/playlist?list=PLtl_gGHV94imfWJv8oGFLQJWDIREGl3Qy8) Очень Вкусные Шашлыки и Еда на Гриле:https://www.youtube.com/playlist?list=PLtl_gGHV94imbxzCuQYVpPx0zoP72ZnuB 9) Рецепты для поста:https://www.youtube.com/playlist?list=PLtl_gGHV94in6l6wEepfNx3SYr43aC6bj10) Варенье - вкус лета. Консервация и разная купоркаhttps://www.youtube.com/playlist?list=PLtl_gGHV94ildLWhDE-ohrjVuXX1S9ezv11) Блины и Оладушки - Лучшие мои Рецепты и Вкусные Завтракиhttps://www.youtube.com/playlist?list=PLtl_gGHV94iluwUjMhCsyHfbctUI5aBVj12) Вкусные Пироги, Пирожки и Булочки Не садись на пенек не ешь пирожокhttps://www.youtube.com/playlist?list=PLtl_gGHV94ikXL3Fstvl1bg5Xl06yAP8Z13)Пасхальный Кулич (Паска) Самые Лучшие Рецептыhttps://www.youtube.com/playlist?list=PLtl_gGHV94ikuIOpuNXLJ2P5fUjXweUGD14)Корзина на Выходные (Готовые меню):https://www.youtube.com/playlist?list=PLtl_gGHV94inET2zaNj61WU8BjhmJoQ6G15)Рецепты в Мультиварке:https://www.youtube.com/playlist?list=PLtl_gGHV94imVxEqs4PlSwfXc_CQ5kChv16) Все Плейлисты: https://www.youtube.com/user/vkysnueveschi/playlists?view=1&sort=dd&shelf_id=12***************************************По вопросам рекламы и сотрудничества: OlgaMatveiy@gmail.com#Салат #salad  #ОльгаМатвей"
