video_id,title,publishedAt,channelId,channelTitle,categoryId,trending_date,tags,view_count,likes,dislikes,comment_count,thumbnail_link,comments_disabled,ratings_disabled,description
"kKe8TXnFSSI","Trying Genius Viral DIY Food Hacks","2020-02-29T18:15:01.000Z","UC6IijBsVf2PlWo_uq6P9wQw","Gloom","24","20.03.03","awful pranks|awful diys|trying lifehacks|diwhy|trying diwhys|reddit|funny|silly|instagram life hacks|edible pranks|awful life hacks|dumbest life hacks|trying|gloom tries|gloom|gloomgames|kassie|123 go|troom troom|pregnancy|pregnant|2020|how to eat food|how to|life hacks|troomtroom pranks|food hacks|viral hacks","990138","26658","1361","2422","https://i.ytimg.com/vi/kKe8TXnFSSI/default.jpg","False","False","These DIY life and food hacks aren't even funny, they're frightening. Thanks for the tips 123 Go!Subscribe to 123 Go: https://www.youtube.com/channel/UCBXNpF6k2n8dsI6nBH8q4sQ?sub_confirmation=1SUBSCRIBE HERE: https://www.youtube.com/channel/UC6IijBsVf2PlWo_uq6P9wQw?sub_confirmation=1My INSTAGRAM: http://www.instagram.com/gloomykassieMy TWITTER: http://www.twitter.com/gloomykassieMy DISCORD SERVER (13 and up only): http://discord.gg/GLOOMMERCH: http://gloom.storeWATCH MY HORRIBLE BITLIVES: https://www.youtube.com/watch?v=-RcgvL6bKZQ&list=PLwbhb6Gu7AnXcLWpGMezpMHtPc6MZIfwYMy TIK TOK is @gloomdog, here's a link: http://vm.tiktok.com/JTHb8L/---------------------------------------------------------------------------I'm Kassie, also known as Gloom! I'm a variety gamer who does gameplay commentary on indie games and some bigger titles too. I also do silly sketches, challenges, Q&As, and whatever makes you goof balls giggle.---------------------------------------------------------------------------I do my best to upload at a few times a week (unless my life is a mess)."
"5pZjjZuBM3E","JE MANGE QUE LA NOURRITURE PAS CHER DU DOLLARAMA PENDANT 24H - HUBY","2020-02-29T12:59:10.000Z","UChTo-9JLadrq6doh6_550OA","HUBY","24","20.03.03","JE MANGE QUE|JE MANGE QUE LA NOURRITURE|PAS CHER|DOLLARAMA|PENDANT 24H|HUBY|24h challenge|je mange|24h|ce que je mange|je mange que du|24h avec moi|challenge 24h|carl is cooking|mange|manger 24h|manger|je mange pendant 24h|uby|huby 24h|isaac hub|hubi|degustation|huby 24|hub 24|hub24|video drole|24h manger|hubi 24 heures|une journée dans mon assiette|hubi 24|24h huby|une journée avec moi|repas|dollarama food|nourriture|alimentation|isaac|hub|defi","394954","22957","492","1513","https://i.ytimg.com/vi/5pZjjZuBM3E/default.jpg","False","False","Aujourd'hui... je fais un 24H challenge où je mange que la nourriture pas cher du dollorama pendant 24hrs. On va voir ce qui se passe! C'est mon défi!#24h #challenge #huby #dollaramaAvec ce challenge je veux voir si c'est possible de manger 24h seulement la nourriture pas cher du dollorama, est-ce que je peux manger des repas facile équilibrés et santé... C'est très drôle, vous passez une journée avec moi pendant que je fais cette dégustation de nourriture pas cher du dollorama. Vous allez passer 24h avec moi et je vais vous documenter mon état d'esprit pendant que je mange que la nourriture pas cher du dollorama.  Vous allez passer une journée dans mon assiette. C'est un challenge et un défi trop drôle à faire avec le dollorama food.Dis-moi en commentaire quelle autre vidéo je pourrais faire pendant 24h.C'était le fun de faire cette vidéo challenge avec la nourriture pas cher du dollorama pendant 24H.Lâche un #grospoucedelike et partage la vidéo avec les gens qui veulent savoir si c'est possible de manger que la nourriture pas cher du dollorama pendant 24h.Chaîne de CARL IS COOKING : https://bit.ly/1nAJhmiChaîne de VLOG FRANÇAIS Carl et Isaac : https://bit.ly/1QTzCyFRetrouve mon livre de slime ici:Au Québec: https://bit.ly/2TYhCNIEn France: https://bit.ly/2BTSrEPAbonne-toi et balance un pouce bleu 👍🏻💙INSTAGRAM : http://bit.ly/2A4lCEX  @isaachubTIKTOK: http://vm.tiktok.com/as2P7V/TWITTER : https://twitter.com/isaac_hubContact (business uniquement) : huby.contact@gmail.com ... et n'oubliez pas, FAUT PAS RESTER SAGE ! 🖖🏻🧔🏻😜 #huby"
"OCEHY2IftHo","Model S vs 3 vs X - Tesla Performance DRAG RACE, ROLLING RACE & BRAKE TEST!","2020-03-01T09:02:32.000Z","UCUhFaUpnq31m6TNX2VKVSVA","carwow","2","20.03.03","carwow|mat watson|4k review|car review|car review 2019|car review 2020|tesla|tesla model s|model s|tesla model s performance|tesla model 3|model 3|tesla model 3 performance|tesla model x|model x|model x p100d|tesla p100d|best electric car|best electric cars|electric car 2020|best electric car 2020|electric car drag race|drag racing|new electric car|performance cars|performance electric car","1089514","36982","756","2174","https://i.ytimg.com/vi/OCEHY2IftHo/default.jpg","False","False","It's the one you electric fanboys have been waiting for... the ultimate Tesla DRAG RACE! We've brought together the most powerful edition of the Model X, Model S and Model 3, and they're going head-to-head over the quarter-mile! Sure, you might think the Model S has it in the bag, but when you consider the Model X can produce 795hp and 1140Nm, is it going to be closer than we anticipated?! You'll have to keep watching to find out!Teslas courtesy of R Symons LTD - https://rsymons.co.ukSubscribe to our Local Channels! carwow Arabic - https://www.youtube.com/channel/UCqLF...carwow Chinese - https://www.youtube.com/channel/UC7Ei...carwow Germany - https://www.youtube.com/channel/UCcft...carwow Indonesia - https://www.youtube.com/carwowIndonesiacarwow Japanese - http://www.youtube.com/carwow日本語 carwow Korean - https://www.youtube.com/channel/UCzm5...carwow Portuguese - https://www.youtube.com/channel/UC0vI...carwow Russian - https://www.youtube.com/channel/UCh3g...carwow Spanish - http://www.youtube.com/c/carwowEspañolSubscribe to Mat’s Channel – https://www.youtube.com/user/MatWatso...Instagram – http://www.instagram.com/carwowcarsFacebook – http://www.facebook.com/carwowukTwitter – http://www.twitter.com/carwowukAwkward haggling is a thing of the past with carwow. Choose your perfect car with our configurator tool and let the country’s best dealers compete over you. Compare the five best offers by price, location and dealer ratings and choose the one that’s right for you – no hassle, no haggling, just a great deal. Visit our site to save money on your new car – http://bit.ly/carwow-UK Oder auch in Deutschland Geld beim Autokauf sparen – http://bit.ly/carwow-DEVisita nuestra página web para saber cuánto te puedes ahorrar en tu nuevo coche – http://bit.ly/carwow-ES"
"HkK8iECmWj4","FINDING NATALIE'S TRUE LOVE | Jeff's Barbershop","2020-02-29T22:03:17.000Z","UCmraHp1nkUsFWLqR7SWToIg","Jeff Wittek","23","20.03.03","Jeff's barbershop|Jeff wittek|vlog squad|David Dobrik|barber|barbershop|haircut|interview|podcast","1681391","87985","813","2747","https://i.ytimg.com/vi/HkK8iECmWj4/default.jpg","False","False","Click below to get the Old Spice Thickening System to keep your hair thick and healthy like mine! #SponsoredObviously http://bit.ly/thickeningJeffJeff’s Barbershop merch is available now at 👇https://www.fanjoy.co/jeff Follow my Instagramhttps://www.instagram.com/jeffTwitter https://www.twitter.com/jeffwittek People in this vid:Davidhttps://www.instagram.com/daviddobrik/Nataliehttps://www.instagram.com/natalinanoel/Ilya https://www.instagram.com/ilyafeddyZanehttps://www.instagram.com/zane/Nickhttps://www.instagram.com/nickantonyan/Outro song bySimon Rexhttps://www.youtube.com/user/dirttothenastyCamera/ EditorOscar Alvahttps://www.instagram.com/oscaralvaCamera man/ Assistant EditorNathan SpeiserHttps://www.instagram.com/nathanspeiserAssitant to the assistant EditorJoe Vulpishttps://www.youtube.com/channel/UCJRb6jaNxNjkLfVg_z8VQ3g"
"017F892wjl0","Dr. Anne Rimoin: Going Viral | Real Time with Bill Maher (HBO)","2020-02-29T05:20:55.000Z","UCy6kyFxaMqGtpE3pQTflK8A","Real Time with Bill Maher","1","20.03.03","Dr. Anne Rimoin|Epidemiology|UCLA Fielding School of Public Health|Pulitzer Prize|The New York Times|Nicholas Kristof|Tightrope Americans Reaching for Hope|E.J. Dionne|The Washington Post|New York Times|Code Red|How Progressives and Moderates Can Unite to Save Our Country|Jane Kleeb|Nebraska|Harvest the Vote|How Democrats Can Win Again in Rural America|Buck Sexton|Former CIA Officer|Nationally Syndicated Radio Host|The Buck Sexton Show","556441","5615","607","1551","https://i.ytimg.com/vi/017F892wjl0/default.jpg","False","False","Subscribe to the Real Time YouTube: http://itsh.bo/10r5A1BField epidemiologist and UCLA professor Anne Rimoin joins Bill to discuss the public health threat posed by the COVID-19 coronavirus.Connect with Real Time Online:Find Real Time on Facebook: https://www.facebook.com/MaherFind Real Time on Twitter: https://twitter.com/RealTimersFind Real Time with Bill Maher Official Site: http://itsh.bo/HttKcM.Find Real Time with Bill Maher on HBO GO® http://itsh.bo/iioY87.Find Real Time with Bill Maher on Connect: http://connect.hbo.com/real-time-bill-maherFind Real Time on Instagram: http://instagram.com/realtimersThe Real Time blog: http://www.real-time-with-bill-maher-blog.com/It's HBO.Connect with HBO OnlineFind HBO on Facebook: http://Facebook.com/HBOFollow @HBO on Twitter: http://Twitter.com/HBOFind HBO on Youtube: http://Youtube.com/HBOFind HBO Official Site: http://HBO.comFind HBO Connect: http://Connect.hbo.comFind HBO GO: http://HBOGO.comFind HBO on Instagram: http://Instagram.com/hboFind HBO on Foursquare: http://Foursquare.com/hboCheck out other HBO ChannelsHBO: http://www.youtube.com/hboGame of Thrones: http://www.youtube.com/GameofThrones True Blood: http://www.youtube.com/trueblood HBO Sports: http://www.youtube.com/HBOsports HBO Documentary Films: http://www.youtube.com/HBODocs Cinemax: http://www.youtube.com/Cinemax HBO Latino: http://www.youtube.com/HBOLatino"
"LwxgOBBGl4I","I am lying to you","2020-02-17T18:00:02.000Z","UCARo1NnyhKXvSxSUI2g5ccQ","Zuquap Studios","23","20.03.03","zuquap|zuquapstudios|zuquap studios|I am lying to you|this is a lie|you are being lied to|meta|reddit funny videos|gus johnson|trevor wallace|wizards with guns|best short videos|reddit meme compilation|new meme|meme|funny meme compilation|slamdank meme compilation|snl|youtube sketch comedy|this video is a lie","281762","7931","215","220","https://i.ytimg.com/vi/LwxgOBBGl4I/default.jpg","False","False","Don't believe everything they tell you. Unless they are telling you they are lying.----------https://teespring.com/stores/zuquap-studios-store"
"ttLuAMFT-XA","$10,000 vs. $100 Football Tickets ft. Sidemen","2020-03-01T12:29:12.000Z","UCQ-YJstgVdAiCT52TiBWDbg","ChrisMD","24","20.03.03","$10000|sidemen|football|chrismd|$100|$10|worth it|w2s|behzinga|calfreezy|callux|arsenal","944919","44303","537","1461","https://i.ytimg.com/vi/ttLuAMFT-XA/default.jpg","False","False","Got hold of row Z standard seats and a box at Fortress Emirates for Arsenal vs. Everton.Callux: https://www.youtube.com/user/OfficialCalluxTheo: https://www.youtube.com/channel/UCAvwetms56ntZtQWkYoqEIQReev: https://www.youtube.com/user/TheReevHD► Follow my Instagram: http://instagram.com/chrismd10► Follow me on Twitter: https://twitter.com/chrismd10► My book: http://amzn.to/2hvWgIUHow I record my gameplay!: https://www.elgato.com/gaming/?utm_source=chrismd&utm_medium=youtube&utm_campaign=GameCaptureHDMusic:0:00 | Danny Cocke – Parasite0:29, 2:36 | (Audiomachine) Piotr Adam Musial – Festival of Light0:57 | (Audiomachine) Steffan Koch– Diaspora1:20, 4:02, 16:13 | Hallmore – The Sky1:49 | Kings and Creatures – As The Empire Falls2:11 | Diviners - Escape (feat. Rossy) [NCS Release] Music provided by NoCopyrightSounds. Watch: https://youtu.be/4EYp7VPa__8 Free Download / Stream: http://ncs.io/EscapeYO3:19 | Niklas Johansson – The End Of All Things 5:09 | Suedo – Not letting Go6:17 | Steerner & Tjernberg Ft. Beerg & Haal - Names (Original Mix)10:16 | Phoenix Music – Guardians of the Earth       Music by Epidemic Sound (http://www.epidemicsound.com) & others."
"o0fG_lnVhHw","HOW ROCKETS ARE MADE (Rocket Factory Tour - United Launch Alliance) - Smarter Every Day 231","2020-02-29T19:25:15.000Z","UC6107grRI4m0o2-emgoDnAA","SmarterEveryDay","28","20.03.03","Smarter|Every|Day|Science|Physics|Destin|Sandlin|Education|Math|Smarter Every Day|nature|demonstration|slow|motion|slow motion|education|math|science|science education|what is science|Physics of|projects|experiments|science projects|rocket|rocket science|United Launch Alliance|SpaceX|RL-10|Rocket Engine|ULA|Delta Rocket|Atlas Rocket|Delta IV|Tory Bruno|Destin Sandlin|Engineering|How to build a rocket|How Rockets are made|How it's made|space|spaceship|centaur","763208","55892","430","4880","https://i.ytimg.com/vi/o0fG_lnVhHw/default.jpg","False","False","Get 1st Audiobook + 2 Audible Originals Free when you try Audible for 30 days https://www.audible.com/smarter or TXT smarter to 500500Interested in subscribing? http://bit.ly/Subscribe2SED2nd Channel Interview with Tory about rocket engines and competitors: https://youtu.be/DQaPOIQLEUo Following Tory Bruno on Twitter is worth your time:https://twitter.com/torybrunoFollowing me on Twitter is probably worth less of your time... but I'd still appreciate it:https://twitter.com/smartereveryday⇊  Click below for more links!  ⇊~~~~~~~~~~~~~~~~~~~~~~~~~~~~GET SMARTER SECTIONUnited Launch Alliance: https://en.wikipedia.org/wiki/United_Launch_AllianceTory Bruno:https://en.wikipedia.org/wiki/Tory_BrunoULA has a website named Rocketbuilder.  You can build your own mission based on payload and destination.  It's fun to play around with it:https://www.rocketbuilder.com/~~~~~~~~~~~~~~~~~~~~~~~~~~~~Tweet Ideas to me at:http://twitter.com/smartereverydaySmarter Every Day on Facebookhttps://www.facebook.com/SmarterEveryDaySmarter Every Day on Patreonhttp://www.patreon.com/smartereverydaySmarter Every Day On Instagramhttp://www.instagram.com/smartereverydaySmarter Every Day SubReddithttp://www.reddit.com/r/smartereverydayAmbiance, audio and musicy things by: Gordon McGladdery https://www.ashellinthepit.com/http://ashellinthepit.bandcamp.com/If you feel like this video was worth your time and added value to your life, please SHARE THE VIDEO!If you REALLY liked it, feel free to help the world get Smarter Every Day by becoming a Patron.http://www.patreon.com/smartereverydayWarm Regards,Destin"
"AeXHvCmzcr8","PROJECT NEIGHBOR's New 2020 Livery is AMAZING! + Slapping on an Upgraded Supercharger!!!","2020-03-01T00:39:26.000Z","UCh8f8vssLddD2PbnU3Ag_Bw","Cleetus McFarland","1","20.03.03","leroy|1320video|drag racing|boosted|cleetus McFarland|cleetus|McFarland|Leroy|bald eagles|bald eagle machine|procharger|1320|modified|boost|turbo|twin turbo|precision turbo|precision turbo and engine|Texas speed|resleeved 427|Texas speed and performance|Fasterproms|tuning|tuned|burnout|stick shift|six speed|corvette|Leroy Vette|c5 corvette|Chevrolet|unicorn|c5|supercharging Leroy|turbocharging Leroy","892962","39460","405","4399","https://i.ytimg.com/vi/AeXHvCmzcr8/default.jpg","False","False","New Shirts and Freedom Factory hats!!! - https://www.cleetusmcfarland.comProject neighbor FINALLY got an updated look! What do ya'll think??Our 2020 Sponsors: https://www.holley.comhttps://texas-speed.comhttps://www.motionraceworks.comhttps://www.nittotire.comhttps://www.summitracing.comCheck out our schedule for 2020 here - https://www.cleetusmcfarland.com/year2020/Cleetus2 Channel - https://goo.gl/Ph2wyoHolley's channel - https://www.youtube.com/channel/UCeQfJXzg0gnfuM4tgmagCCw**Social Media:Instagram - https://goo.gl/LZvy5eFacebook - https://goo.gl/gdwhh1**SEND ME FAN MAIL... (bald eagles welcome) Cleetus McFarland12961 44th St N. Ste BClearwater, FL 33762United States of America"
"Nm8Spw8gv24","WE'RE DATING NOW, RIGHT?! Ft. Michael Reeves - Road Trip | Crunchyroll Awards","2020-02-29T17:30:01.000Z","UCvWU1K29wCZ8j1NsXsRrKnA","LilyPichu","24","20.03.03","lilypichu|lily|highlights|hilarious|funny|twitchtv|moments|offlinetv|michael reeves|dating|relationship|crunchyroll awards|disguisedtoast|fedmyster|ariasaki|jummychu|temmie|san francisco|valentines day|anime","1245666","75358","682","4677","https://i.ytimg.com/vi/Nm8Spw8gv24/default.jpg","False","False","uwuEXPAND ME ヽ(´益`)ﾉFollow me (•ิ_•ิ)►LilyPichuVoDs - https://www.youtube.com/lilypichuvods►Filler Arc - https://www.youtube.com/channel/UCWOud-tvQTPqDM_PyB8BJ-A►TWITCH - https://twitch.tv/lilypichu►TWITTER - https://twitter.com/lilypichu►INSTAGRAM - https://www.instagram.com/lilypichu/►DISCORD - https://discord.gg/lilypichu►FACEBOOK - https://www.facebook.com/lilypichu►Edited by - https://twitter.com/StevoTevo►Thumbnail by - https://twitter.com/LReimi"
"5L6xyaeiV58","Lady Gaga - Stupid Love (Official Music Video)","2020-02-28T05:00:00.000Z","UC07Kxew-cMIaykMOkzqHtBQ","LadyGagaVEVO","10","20.03.03","Lady|Gaga|Stupid|Love|Interscope|Records|Pop","21116363","917986","85888","108997","https://i.ytimg.com/vi/5L6xyaeiV58/default.jpg","False","False","“STUPID LOVE” THE NEW SINGLE & VIDEO FROM LADY GAGAOUT NOWhttp://smarturl.it/StupidLoveShot entirely on the iPhone 11 ProDirected by Daniel AskillListen On @applemusic #ShotOniPhone: http://apple.co/StupidLoveYTListen on Spotify: http://smarturl.it/StupidLove/spotifyListen on Amazon: http://smarturl.it/StupidLove/amazonunlimitedListen on YouTube Music: http://smarturl.it/StupidLove/youtubemusicFOLLOW LADY GAGA:Facebook: http://gaga.lk/facebookInstagram: http://gaga.lk/InstagramSnapchat: http://gaga.lk/SnapchatTwitter: http://gaga.lk/TwitterWebsite: http://www.ladygaga.com/Official Store: http://gaga.lk/GagaStoreEmail List: http://gaga.lk/NewsMusic video by Lady Gaga performing Stupid Love. © 2020 Interscope Recordshttp://vevo.ly/5UJ8jb"
"HcornGi_TqA","Highlights: Watford 3-0 Liverpool | Reds suffer first Premier League defeat","2020-02-29T22:00:08.000Z","UC9LQwHZoucFT94I2h6JOcjw","Liverpool FC","17","20.03.03","Liverpool FC|LFC|Liverpool|Anfield|Melwood|Liverpool Football Club|premier league|watford vs liverpool|watford liverpool|liverpool watford|deeney liverpool|sarr liverpool|sarr goal|liverpool highlights","2376377","33195","2556","4525","https://i.ytimg.com/vi/HcornGi_TqA/default.jpg","False","False","Watch key highlights from Vicarage Road, where Liverpool were beaten in the league for the first time this season, going down 3-0 to Watford.Enjoy more content and get exclusive perks in our Liverpool FC Members Area, click here to find out more: https://www.youtube.com/LiverpoolFC/joinSubscribe now to Liverpool FC on YouTube now and get notified when new videos land: https://www.youtube.com/subscription_center?add_user=LiverpoolFC"
"Lef8m44Zlrg","Curling My Hair With Bananas","2020-02-29T16:31:35.000Z","UCGCVyTWogzQ4D170BLy2Arw","Simply Nailogical","24","20.03.03","nails|nail art|nail tutorial|beauty tutorial|nail art tutorial|diy nails|diy nail art|simply nailogical|cristine|banana|banana curls|curl hair|how to curl your hair with bananas|banana diy|hair hacks|hair tutorial|hair style|curling your hair hack|curly hair hack|ben|ben bananas|rclbeauty101|troom troom|parody","1032044","78603","594","7334","https://i.ytimg.com/vi/Lef8m44Zlrg/default.jpg","False","False","At this point I am Banana Guru🍌Got boring nails? Just add a Holo Taco 💿🌮 Sign up for email updates to be notified about restocks ➡️ http://holota.co/holothere1 ♡ Subscribe to never miss n̶e̶w̶ ̶n̶a̶i̶l̶ ̶a̶r̶t̶ ̶t̶u̶t̶o̶r̶i̶a̶l̶s̶! http://bit.ly/subsimply♡ Subscribe to Holo Taco (for nail videos lol): http://bit.ly/SubHoloTaco♡ Subscribe to the Podcast to hear me have adult conversations: http://bit.ly/SubSimplyPodLogicalRclbeauty101 video: https://www.youtube.com/watch?v=5awQifISbdgOther times I did something to my hair:http://bit.ly/SimplyHairStylehttp://bit.ly/HolographicHairFoamhttp://bit.ly/HOLOHairCutMore great Simply Banana content:http://bit.ly/BananaPianohttp://bit.ly/BananaNails4Baehttp://bit.ly/BananaLifeHackshttp://bit.ly/BananaPopArt_ _ _ _ _ _ _ _ _ _ _ _ _ _ _ _ _ _ _ _ _ _ _ _ _ _ _ _ _ _ _ _ _ _Wearing on my nails: 👀_ _ _ _ _ _ _ _ _ _ _ _ _ _ _ _ _ _ _ _ _ _ _ _ _ _ _ _ _ _ _ _ _ _Stalk me on all the social medias!http://instagram.com/simplynailogicalhttps://www.snapchat.com/add/simplynailogicahttps://twitter.com/nailogicalhttps://www.facebook.com/simplynailogicalhttps://youtube.com/user/simplynailogicalhttps://www.youtube.com/c/simplynotlogicalhttp://www.simplynailogical.com (archival materials)_ _ _ _ _ _ _ _ _ _ _ _ _ _ _ _ _ _ _ _ _ _ _ _ _ _ _ _ _ _ _ _ _ _I filmed my face in this video with this camera: https://amzn.to/327OB7bThis lens: https://amzn.to/38HnBgUB cam: https://amzn.to/3cfSjjBB cam lens: https://amzn.to/2TnoULHAudio recorder: http://amzn.to/2cU7t3jExternal mic: https://amzn.to/32AnO3gRing light for face-cams: http://amzn.to/2cU7cNOI edit my videos with: http://bit.ly/videoeditor1I get some cool editing filters from: https://motionvfx.sjv.io/Ze3bRCheck out my personalized Amazon page with stuff I like! https://www.amazon.com/shop/simplynailogicalMusic: http://share.epidemicsound.com/SIMPLY_ _ _ _ _ _ _ _ _ _ _ _ _ _ _ _ _ _ _ _ _ _ _ _ _ _ _ _ _ _ _ _ _ _Disclaimer cause I love you guys: This video was not sponsored by any of the brands mentioned. All opinions are my own. Some links above are affiliate links."
"Zgaf9ycRLJE","The Try Guys Recreate Awkward Middle School Photos","2020-02-29T16:00:08.000Z","UCpi8TJfiA4lKGkaXs__YdBA","The Try Guys","23","20.03.03","try guys|keith|ned|zach|eugene|habersberger|fulmer|kornfeld|yang|buzzfeedvideo|buzzfeed|ariel|ned & ariel|comedy|education|funny|try|learn|fail|experiment|test|tryceratops|school|middle school|junior high|transform|transformation|photo|photos|photoshoot|teenager|horror stories|puberty|awkward|awkward moments|school stories|best|worst|popular|most popular","1678962","85613","693","4324","https://i.ytimg.com/vi/Zgaf9ycRLJE/default.jpg","False","False","We decided to re-live the worst of times and recreate our awkward middle school photos to reflect and see how far we've come! Share your middle school pics using #TryGuysMiddleSchool with us on social if you dare! We wanna see em! Are you a business looking to work with The Try Guys? Reach out to us at 2ndtrybusiness@gmail.com for all business inquiries! 🎧THE TRYPOD 🎧: watch our new podcast at https://youtube.com/trypod or listen at https://tryguys.com/podcast📘THE HIDDEN POWER OF F*CKING UP 📘: check out our new book at https://tryguys.com/bookGet your official Try Guys color hoodies and phone cases at https://tryguys.com/collections/color-line 💙❤️💚💜Support us! http://www.patreon.com/tryguys. Join our Patreon to get videos a day early, plus, live streams, chatrooms, BTS footage, exclusive merchandise, and more!SUBSCRIBE TO AND FOLLOW THE TRY GUYS http://www.youtube.com/c/tryguyshttp://www.facebook.com/tryguys  http://www.twitter.com/tryguyshttps://www.instagram.com/tryguysFOLLOW THE GUYShttp://www.Instagram.com/keithhabshttp://www.Instagram.com/nedfulmerhttp://www.Instagram.com/korndiddyhttp://www.instagram.com/eugeneleeyang http://www.twitter.com/keithhabshttp://www.twitter.com/nedfulmer http://www.twitter.com/korndiddyhttp://www.twitter.com/eugeneleeyang THE TRY GUYSThe #TryGuys is the flagship channel of 2ND TRY, LLC. Tune in twice a week for shows from Keith, Ned, Zach and Eugene, the creators and stars of The Try Guys.EDITED BYElliot Dickerhoof MUSICLicensed from AudioNetworkSFXLicensed from AudioblocksVIDEOLicensed from VideoblocksOfficial Try Guys Photos By Mandee Johnson Photography | @mandeephoto2nd Try, LLC STAFFExecutive Producer - Keith HabersbergerExecutive Producer - Ned FulmerExecutive Producer - Zach KornfeldExecutive Producer - Eugene Lee YangProducer - Rachel Ann ColeProducer - Nick RufcaProduction Manager - Alexandria HerringEditor - Devlin McCluskeyEditor - YB ChangEditor - Elliot DickerhoofAssistant Editor - Will WitwerCamera Operator - Miles BonsignoreSound Operator - Jonathan KirkAssistant Production Coordinator - Sam JohnsonContent Strategist - Kaylin BurkeSpecial Thanks To! Thanks to all of our Gold Level Patrons! AJ S., Amy Fleming, Ana Camba, Cat Hicks, Elisa Proust, Emma Godfrey, Erica Rao, Jared Aarons, Kelsey Bock, Kourtney Wong, Loretta Wen, Matthew Tadros, Miha, Paulus, Sarah Waxman, Traci Lew, Wendy Tran, Lily"
