video_id,title,publishedAt,channelId,channelTitle,categoryId,trending_date,tags,view_count,likes,dislikes,comment_count,thumbnail_link,comments_disabled,ratings_disabled,description
"2fqYgNR6174","Shaquille O'Neal Speaks at A Celebration of Life for Kobe and Gianna Bryant","2020-02-25T01:56:21.000Z","UC8CSt-oVqy8pUAoKSApTxQw","Los Angeles Lakers","17","20.03.03","Lakers|NBA|Basketball|Los Angeles|Showtime|LakeShow|LA|Sports|National Basketball Association","3859703","53862","2489","2672","https://i.ytimg.com/vi/2fqYgNR6174/default.jpg","False","False","Subscribe for the latest Lakers' content: https://www.youtube.com/channel/UC8CSt-oVqy8pUAoKSApTxQwFollow us on Facebook: https://www.facebook.com/lakersFollow us on Instagram: https://www.instagram.com/lakers/Follow us on Twitter: https://twitter.com/LakersGet the Lakers app: https://www.nba.com/lakers/multimedia...Check out the Lakers full 2019-20 regular-season schedule: https://www.nba.com/lakers/schedule"
"Q_Myud-0WjE","Vanessa Bryant shares powerful, emotional words at Kobe and Gianna Bryant Memorial | CBS Sports HQ","2020-02-24T20:26:40.000Z","UCja8sZ2T4ylIqjggA1Zuukg","CBS Sports","17","20.03.03","CBS|CBS Sports|sports|kobe bryant|kobe bryant death|kobe bryant tribute|los angeles lakers|kobe bryant daughter|los angeles|black mamba|kobe bryant dead|kobe death|kobe bryant helicopter crash|kobe bryant funeral|kobe bryant memorial","6410696","127465","6262","11562","https://i.ytimg.com/vi/Q_Myud-0WjE/default.jpg","False","False","A public memorial to celebrate the life of Kobe and Gianna Bryant, along with seven victims who died in the tragic helicopter crash took place 2/24/2020 at Staples Center.SUBSCRIBE TO OUR CHANNEL:https://www.youtube.com/user/CBSSports FOLLOW US ON:Facebook - https://www.facebook.com/CBSSports/Instagram - https://www.instagram.com/cbssports/Twitter - https://twitter.com/CBSSports#NBA #KobeBryant #VanessaBryant #KobeMemorial"
"587ZD-y4LQE","ARK: Genesis - Part 1 Expansion Pack!","2020-02-26T04:45:15.000Z","UCEYfsfyne69mFfNTcZeZ6gw","ARK: Survival Evolved","20","20.03.03","ark|ark survival evolved|survival evolved|dinosaur game|xbox one|pc|steam|Genesis|ark genesis|expansion|dlc|trailer|release","672379","29797","642","3029","https://i.ytimg.com/vi/587ZD-y4LQE/default.jpg","False","False","CONTINUE YOUR QUEST FOR ULTIMATE SURVIVAL!Awaking within a virtual simulation, you must survive across exotic worlds unlike anything you’ve seen before! With a strangely familiar companion at your side, you must overcome the simulation’s rigorous missions. Only by fighting, building, taming, and exploring will you uncover the secrets behind this forbidding place.ARK: Genesis represents a new, story-oriented beginning in ARK’s epic saga of survival where your skill determines your success. Everything is turned up to the highest setting: the challenges, the dangers...and the vast rewards. Only the toughest and smartest survivors will pass the simulation’s many tests. Will you be one of them?ARE YOU THE ULTIMATE SURVIVOR?ARK Genesis: Part I Is Available Now!https://playark.com/genesis/Twitter at https://www.twitter.com/survivethearkLike us on Facebook https://www.facebook.com/survivetheark/Visit the Website: http://playark.comCommunity Hub: http://www.survivetheark.comSubreddit: https://www.reddit.com/r/playarkInstagram: https://www.instagram.com/survivethearkPlus watch us tame and train leviathan creatures: https://www.twitch.tv/survivetheark"
"FHpE1FnIEpM","REAL TWIN TELEPATHY TEST - Merrell Twins","2020-02-25T15:58:47.000Z","UCwtnkRZcvL4bfopzJ-Von8Q","merrelltwins","23","20.03.03","Merrell Twins|Twins|Merrell|Veronica Merrell|Vanessa Merrell|Twin|Comedy|Family Friendly|telepathy|twin telepathy test|twins test|twin telepathy challenge|nessa|twin my heart|merrell twins dating|identical twin sisters|merrell twins live|real|real test|real twin telepathy test|drive thru|Swap|twinner","957106","43354","556","3047","https://i.ytimg.com/vi/FHpE1FnIEpM/default.jpg","False","False","We test our Twin Telepathy to see if we can choose the same item! SUBSCRIBE TO OUR CHANNEL ▶ http://bit.ly/2dSP9Fg GET SOME MERCH ▶ https://fanjoy.co/collections/merrell-twinsCheck Out Our Other Videos:THE THIRD WHEELhttps://youtu.be/uHYI42E8TKYTHAT ONE FRIENDhttps://youtu.be/aeOpNraDKy8Merrell Twins Exposed ep1https://youtu.be/mWXurqWRA742 Sets of Twins Drive Thru Prankhttps://youtu.be/p15SVRulr58Fans Write our Videohttps://youtu.be/WI0LYRZErjUThe Break Uphttps://youtu.be/MyS8AjVj9FQIF FOOD BABIES WERE REALhttps://youtu.be/joMRNv0SlYETHIS COULD BE YOUhttps://youtu.be/U9v_bUMqFHgFIRST DATEhttps://youtu.be/IydaRQClUBYFollow Us on Twitter & Instagram: TWITTER: https://twitter.com/MerrellTwinsINSTAGRAM: http://instagram.com/MerrellTwinsFACEBOOK: https://www.facebook.com/MerrellTwinsTWITTER: https://twitter.com/VanessaMerrellTWITTER: https://twitter.com/veronicamerrellINSTAGRAM: http://instagram.com/vanessamerrellINSTAGRAM:http://instagram.com/veronicamerrellwww.merrelltwins.com#twin#telepathy#testing"
"kSiT3yTtetw","Prince Harry & Meghan Markle Drop Their Royal Titles | The Daily Show With Trevor Noah","2020-02-25T11:58:56.000Z","UCsv4YOF2RBYh0NQ1vuHQ-hg","Comedy Central UK","23","20.03.03","comedy central uk|meghan markle|meghan markle interview|prince harry and meghan markle|prince harry and meghan markle documentary|prince harry interview|prince harry and meghan markle baby|prince harry and meghan markle interview|prince harry stepping down|trevor noah royals|royal family|british royal|british royal family|british royal family documentary|british royal family news|step down|daily show|trevor noah harry|trevor noah harry and meghan","142054","1791","157","202","https://i.ytimg.com/vi/kSiT3yTtetw/default.jpg","False","False","Prince Harry and Meghan Markle lose their royal titles, Harvey Weinstein is found guilty of sexual assault, and the coronavirus outbreak leads to lockdowns in Italy.Subscribe to Comedy Central UK: http://bit.ly/1gaKaZOCheck out the Comedy Central UK website: http://bit.ly/1iBXF6jGet social with Comedy Central UK:Twitter:  https://twitter.com/ComedyCentralUKFacebook: https://www.facebook.com/comedycentraluk"
"NZ5-fWmdBGs","BATTLE DE DESSIN ! (ft. NORMAN)","2020-02-25T18:07:18.000Z","UCpWaR3gNAQGsX48cIlQC0qw","Tibo InShape","17","20.03.03","tibo inshape|teamshape|BATTLE DE DESSIN|norman|tibo inshape norman|juju tibo norman|norman fait des vidéos|BATTLE DE DESSIN ! (ft. NORMAN)|tibo norman|inshape norman","1271921","83888","1952","6580","https://i.ytimg.com/vi/NZ5-fWmdBGs/default.jpg","False","False","Challenge dessin sans model avec Norman !Clique ici pour t'abonner ► http://bit.ly/1qAbjhL & rejoins la TeamShape !Mes vêtements TeamShape ► http://bit.ly/1wXqeD7 Mes compléments Inshape Nutrition ►https://bit.ly/2M9v9QVMes programmes ►https://bit.ly/2TDimHNMa salle de sport ►http://bit.ly/2jaOdSOHARCÈLE-MOI sur : TWITTER : http://bit.ly/1o88uUVINSTAGRAM : http://bit.ly/1Q4RInr (tiboinshape)SNAPCHAT : tiboinshapeTIKTOK : tiboinshapeFACEBOOK : http://on.fb.me/1EcbKmeDISCORD : http://discord.gg/teamshapeSPOTIFY : Tibo InShape - Motivation (playlist)Mon adresse postale : Tibo InshapeCS 5207281012 ALBI CEDEXMon e-mail (business uniquement) ► tiboinshapevideo@gmail.comSi vous lisez cette phrase écrivez « DAAMN » en commentaire !"
"FP60G0DbVxc","The 2020 C8 Corvette is the BEST way to spend $60,000 *World's First DONUTS!*","2020-02-25T13:04:02.000Z","UC86SBFIAgnYL3ll2ZDgmsuA","TheStraightPipes","2","20.03.03","TheStraightPipes|The Straight Pipes|Straight Pipes|StraightPipes|Exhaust|Sound|Review|2020|Chevrolet|Chevy|C8|Corvette|C8 Corvette|Mid Engine|Mid Engine Corvette|Stingray|C8 Corvette Review|2020 Chevrolet Corvette|2020 C8 Corvette|Corvette Review|2020 Corvette Review|Chevrolet Corvette|Z51|Z51 Performance|Z51 Performance Package|Sports|Sports car|Supercar|Super car","904162","22723","846","4029","https://i.ytimg.com/vi/FP60G0DbVxc/default.jpg","False","False","2020 Chevrolet C8 Corvette Review. This C8 Corvette review was filmed on the roads without the Z51 Package and on the track with the C8 Corvette Z51 package. The C8 Corvette is pumping out 495hp and 470lb-ft tq from a 6.2L V8. At $58,900, would this be your pick over the Porsche Cayman, Porsche Boxster, Toyota Supra, McLaren GT, McLaren 570S, Ferrari 488, Lamborghini Huracan, Audi R8, Acura NSX?Support us on Patreon: https://www.patreon.com/thestraightpipesBecome a YouTube Member! https://www.youtube.com/channel/UC86SBFIAgnYL3ll2ZDgmsuA/joinSubscribe! http://www.youtube.com/subscription_center?add_user=TheStraightPipesFacebook! https://www.facebook.com/thestraightpipesInstagram! https://www.instagram.com/thestraightpipesTwitter! https://twitter.com/StraightPipersBuy our merch at https://teespring.com/stores/thestraightpipesCheck out Continental Tire at https://www.continentaltire.ca-------------------#chevrolet #c8 #corvette-------------------"
"SZD7wyfyhro","Samsung Galaxy Buds+ (vs AirPods, Galaxy Buds)","2020-02-25T17:00:06.000Z","UCsTcErHg8oDvUnTzoqsYeNw","Unbox Therapy","28","20.03.03","galaxy buds+|galaxy buds plus|galaxy|buds|buds+|samsung|samsung galaxy buds+|samsung galaxy|galaxy buds|samsung galaxy buds|galaxy s20|galaxy s20+|galaxy s20 ultra|s20|s20+|s20 ultra|ultra|2020|airpods|airpods 2|airpods pro|apple|apple airpods|vs|galaxy buds vs|galaxy buds+ vs|airpods vs|airpods pro vs|unbox therapy|unboxing|lew later|galaxy buds+ unboxing|galaxy buds unboxing","1820478","46258","1381","2980","https://i.ytimg.com/vi/SZD7wyfyhro/default.jpg","False","False","Samsung Galaxy Buds+ (USA Link) - https://amzn.to/2w7JaZCSamsung Galaxy Buds+ (International) - https://geni.us/udLU9yXFOLLOW ME IN THESE PLACES FOR UPDATESTwitter - http://twitter.com/unboxtherapyFacebook - http://facebook.com/lewis.hilsentegerInstagram - http://instagram.com/unboxtherapy"
"ZObdI758UiY","Dance Battle: Girls vs. Guys | Twin My Heart w/ The Merrell Twins Season 2 EP 2 Pt 1","2020-02-25T15:13:51.000Z","UCWljxewHlJE3M7U_6_zFNyA","AwesomenessTV","24","20.03.03","awesomenesstv|awesomeness|merrelltwins|merrell|vanessa merrell|veronica merrell|vanessa|veronica|roni and nessa|roni|nessa|twins|identical twins|identical twin sisters|twin my heart|reality show|dating show|dating competition|merrell twins dating|veronica boyfriend|vanessa boyfriend|boyfriend|Merrell twins videos|twin vs. twin|challenge​|bff vs. bff|best friend|best friend vs best friend|best friends|franny arrieta|franny|nezza|baby nezza","654686","22335","244","1847","https://i.ytimg.com/vi/ZObdI758UiY/default.jpg","False","False","The guys hit the floor to compete in an ultimate dance battle to impress Franny and Nezza.EP 1: The Worst First Date Ever Pt. 2  https://youtu.be/qMOQFW3ai-0Veronica and Vanessa Merrell are setting up not one, but two of their best friends, Franny and Nezza, as they search for love. It's a race to win their hearts, as contestants compete in challenges, deciding who will stay and who will go. ❤️The guys hit the floor to compete in an ultimate dance battle to impress Franny and Nezza. But when one guy takes it too far with another contestant, the girls must decide if his actions are cause for an automatic elimination ... stay tuned for part 2 on Thursday!  🙅‍♀️💕Twin My Heart airs on Tuesdays & Thursdays at 5:15 a.m. PST only on AwesomenessTV 😍→ Watch Twin My Heart Season 2 Episodes ←    EP 1: Finding a Boyfriend (for My Best Friend) Pt.1 https://youtu.be/xzixwiGXKOcEP 1: The Worst First Date Ever Pt. 2  https://youtu.be/qMOQFW3ai-0→ Listen to Twin My Heart, The Podcast for Exclusive Season 2 Tea ←  Apple Podcast: https://podcasts.apple.com/us/podcast/twin-my-heart-the-podcast/id1498664379→ Watch Twin My Heart Season 2 Challenges ←   Who knows the Merrell Twins Better? Best Friend Challenge w/ Franny and Nezza: https://youtu.be/Dr1svpDlyxc Twin My Heart S2 Lie Detector Challenge (secrets revealed!) w/ Merrell Twins, Franny & Nezza: https://youtu.be/1w0CaK9aOXI Twin vs. Twin Smoothie Challenge w/ the Merrell Twins: https://youtu.be/xmdnbgElpmk  What REALLY happens on a reality dating show *IS IT REAL* w/ the Merrell Twins: https://youtu.be/_BiFt4t1izI→ Catch Up on Twin My Heart Season 1 Episodes on AwesomenessTV ←  Ep 1: Finding My Twin Sister a Boyfriend | Twin My Heart w/ The Merrell Twins: https://youtu.be/vZKmtPBd3XgEp 2: 7 Guys Take My Twin Sister's Compatibility Test | Twin My Heart w/ The Merrell Twins: https://youtu.be/qXycu5_glbs  Ep 3: Twin Sister Double Date | Twin My Heart w/ The Merrell Twins: https://youtu.be/jsm0jzf1um8Ep 4: Dad vs My 5 Boyfriends | Twin My Heart w/ The Merrell Twins: https://youtu.be/CDI5NROdJcw Ep 5: Twin Swap Prank + HE has a GIRLFRIEND!! | Twin My Heart w/ The Merrell Twins: https://youtu.be/2Xzq4EWWi5I Ep 6: The Guy Who Won My Twin Sister's Heart (BIG REVEAL) | Twin My Heart w/ The Merrell Twins: https://www.youtube.com/watch?v=y7PAGuRq_eM  → Talent Credits ← Merrell Twins Channel: https://www.youtube.com/user/merrelltwins   Franny Arrieta Channel: https://www.youtube.com/channel/UCtQ7zqr9cWlvnPLq2GSS-1ANezza Channel: https://www.youtube.com/user/VVVSAYSDANCEJermaine Sanders: https://www.instagram.com/jermaine_ws/ → Crew Credits ← Director + Supervising Producer: Katherine MartinezExecutive Producer: Vanessa Merrell @VanessaMerrell Executive Producer: Veronica Merrell @VeronicaMerrell Executive Producer: Paul Merrell @ThePaulMerrell Producer: Taylor Henriquez @TaylorHenriquez Editors: Jennifer Reilly, Shayna Thea @ShaynaThea 1st AD: Aaron Ellis Director of Photography: Trevor Roach Camera Operators: Hao Yu, Connor Vickers, Edward Uken 1st AC's: Robert P. Chuck, Stephen HoSound Mixers: Rommel Sungia, Will Mill, Ken Hobson, Victor Salas AlcaronPA's: Preston Grant, Paul Rivet, Scott RojasDIT: CJ BallesterosLine Producer: Brett HodgsonProduction Manager: Lauren C BrooksProduction Coordinator: Tina Poston           → SUBSCRIBE FOR NEW VIDEOS DAILY! ←            http://bit.ly/subscribe2AwesomenessTV             instagram - http://instagram.com/awesomenessTV            TikTok - https://www.tiktok.com/@awesomenesstv           facebook - http://facebook.com/awesomenessTV           snapchat - http://snapchat.com/add/awesomenessTV           twitter - http://twitter.com/awesomenessTV   If you see this, comment below on who you think was the BEST dancer. 🕺#awesomenessTV #MerrellTwins #TwinMyHeart"
"y1zlbsG_wk8","Michael Jordan remembers Kobe Bryant in beautiful tribute","2020-02-24T22:58:09.000Z","UC--i2rV5NCxiEIPefr3l-zQ","TSN","17","20.03.03","#Kobe|#KobeBryant|#MJ|#MichaelJordan|#Lakers|#RIPKobe","1172513","19514","493","1691","https://i.ytimg.com/vi/y1zlbsG_wk8/default.jpg","False","False","Michael Jordan pays tribute to Kobe Bryant and gives us an intimate look at their relationship at his memorial with a touching, heartbreaking, and beautiful speech."
"gCMQS3UDabo","Here’s Why the New Mercedes-AMG G63 Is Worth $200,000","2020-02-25T16:56:23.000Z","UCsqjHFMB_JYTaEnf_vmTNqg","Doug DeMuro","2","20.03.03","2020 mercedes g63|2020 mercedes-amg g63|2020 g63|new g63|g63 amg|mercedes g63|mercedes-amg g63|g63 review|2020 g63 review|new g63 review|mercedes g63 review|mercedes-amg g63 review|g63 amg review|amg g63 review|doug demuro|demuro","950656","21788","1099","3834","https://i.ytimg.com/vi/gCMQS3UDabo/default.jpg","False","False","THANKS TO CNC MOTORS!https://www.cncexotics.com/https://www.instagram.com/cncexotics/The 2020 Mercedes-AMG G63 is one of the most desirable new SUVs. Today I'm showing you why so many people love the G63, and I'm going to show you all the quirks of the new G63 AMG. Then I'm driving the 2020 AMG G63 to show you what it's like on the road.NEW MERCEDES-BENZ G550 REVIEW:https://www.youtube.com/watch?v=blY69sLgK6oWEBSITE & MERCH!http://www.dougdemuro.comFOLLOW ME!Twitter - http://www.twitter.com/dougdemuroInstagram - http://www.instagram.com/dougdemuroFacebook - http://www.facebook.com/ddemuroDOUGSCORE CHART: https://www.dougdemuro.com/dougscore"
"hdik-ySEetI","Water Is WAY Weirder Than We Thought","2020-02-25T23:34:40.000Z","UCZYTClx2T1of7BRZ86-8fow","SciShow","27","20.03.03","SciShow|science|Hank|Green|education|learn|water|olivia gordon|glass phase|ice|chemistry|liquid|temperature|h2o|molecule|subatomic|glass|space|space dust|hydrogen|heavy water|deuterium|mass|quantum|polymer|joints|bones|biology","378183","16640","563","1134","https://i.ytimg.com/vi/hdik-ySEetI/default.jpg","False","False","Water is one of the most abundant and important substances on Earth, so you think we'd know everything there is to know about it. But it turns out water is way weirder, and it often behaves in ways that leave scientists with more questions than answers.Hosted by: Olivia GordonSciShow has a spinoff podcast! It's called SciShow Tangents. Check it out at http://www.scishowtangents.org----------Support SciShow by becoming a patron on Patreon: https://www.patreon.com/scishow----------Huge thanks go to the following Patreon supporters for helping us keep SciShow free for everyone forever:Kevin Bealer, KatieMarie Magnone, D.A. Noe, Charles Southerland, Eric Jensen, Christopher R Boucher, Alex Hackman, Matt Curls, Adam Brainard, Scott Satovsky Jr, Sam Buck, Avi Yashchin, Ron Kakar, Chris Peters, Kevin Carpentier, Patrick D. Ashmore, Piya Shedden, Sam Lutfi, charles george, Greg ----------Looking for SciShow elsewhere on the internet?Facebook: http://www.facebook.com/scishowTwitter: http://www.twitter.com/scishowTumblr: http://scishow.tumblr.comInstagram: http://instagram.com/thescishow----------Sources:http://phl.upr.edu/library/media/liquidwaterinthesolarsystemhttps://www.usgs.gov/special-topic/water-science-school/science/water-you-water-and-human-body?qt-science_center_objects=0#qt-science_center_objectshttps://www.usgs.gov/special-topic/water-science-school/science/how-much-water-there-earth?qt-science_center_objects=0#qt-science_center_objectshttps://cbe.princeton.edu/news/two-liquid-phases-found-molecular-model-water-letter-naturehttps://www.researchgate.net/publication/263291438_Metastable_liquid-liquid_transition_in_a_molecular_model_of_waterhttps://phys.org/news/2008-01-scientists-mystery-glassy.htmlhttps://www.pnas.org/content/114/51/13336https://science.sciencemag.org/content/294/5550/2305http://www1.lsbu.ac.uk/water/amorphous_ice.html#ehttps://www.thoughtco.com/weird-and-interesting-water-facts-4093451http://www.loerting.at/publications/seidl15-prb.pdfhttps://goldbook.iupac.org/terms/view/O04321https://www.pnas.org/content/111/26/9413https://chem.libretexts.org/Bookshelves/Introductory_Chemistry/Book%3A_Introductory_Chemistry_(CK-12)/17%3A_Thermochemistry/17.04%3A_Heat_Capacity_and_Specific_Heathttps://www.space.com/40870-interstellar-dust-from-solar-system.htmlhttps://www.researchgate.net/publication/8688931_Clarifying_the_Glass-Transition_Behaviour_of_Water_by_Comparison_with_Hyperquenched_Inorganic_Glasseshttps://www.eurekalert.org/pub_releases/2019-12/epfd-lfi120919.phphttps://advances.sciencemag.org/content/5/12/eaay1443http://rubinsteinlab.pratt.duke.edu/research/polyelectrolytehttps://wp.nyu.edu/tuckerman_group/research/nuclear-quantum-effects/https://arxiv.org/pdf/0803.3635.pdfhttp://mini.physics.sunysb.edu/~marivi/research/nuclear-quantum-effects/https://arxiv.org/pdf/1803.01037.pdfhttps://www.britannica.com/science/heavy-waterhttp://www.chem.ucla.edu/~harding/IGOC/E/electrostatic_interaction.htmlhttps://www.nature.com/articles/pj2006163.pdf?origin=ppubhttps://pubs.acs.org/doi/pdf/10.1021/acs.macromol.7b01929http://tramfloc.com/polymers-water-clarification/https://www.ncbi.nlm.nih.gov/pmc/articles/PMC2587658/https://www.nature.com/articles/s41570-017-0109"
"Rs4KDxRoeNo","How Do You Ruin Pizza? - Eat It Or Yeet It #11","2020-02-25T18:00:04.000Z","UCYJPby9DRCteedh5tfxVbrw","Smosh Pit","22","20.03.03","smosh|smosh pit|smosh games|funny|comedy|How Do You Ruin Pizza? - Eat It Or Yeet It #11|eat it or yeet it|eat or yeet|pizza|favorite pizza place|courtney miller|shayne topp|damien haas|keith leak jr|matt raub|joe bereta|garrett palm|sarah whittle|food|challenge|gross food|weird food","925514","45819","644","2880","https://i.ytimg.com/vi/Rs4KDxRoeNo/default.jpg","False","False","Today, Garrett ruins pizza for us for 15 minutes straight. This round of Eat It Or Yeet It just may be our *LEAST* favorite pizza place. Punch that bell icon so you'll know when we add a new episode!SHOP THE SMOSH CLOTHING LINE: https://smosh.storeWatch Every Library Ever: https://youtu.be/cXyWP6ezTWkWatch We Roast Our Friends and Everyone is Sad | Jackbox Joke Boat: https://youtu.be/hFHBLQXohJYWatch Nerding Out with The Boys - SmoshCast #51: https://youtu.be/opFdEAK-hy8Subscribe To Smosh Pit: Smosh: https://smo.sh/Sub2SmoshPitFollow Us:Instagram: https://instagram.com/smoshFacebook: https://facebook.com/smoshTwitter: https://twitter.com/smoshCourtney Miller: https://www.instagram.com/co_mill/Shayne Topp: https://www.instagram.com/shaynetopp/Damien Haas: https://www.instagram.com/damienhaas/Keith Leak: https://www.instagram.com/keithleakjr/Matt Raub: https://www.instagram.com/mattraub/Joe Bereta: https://www.instagram.com/joebereta/Garrett Palm: https://www.instagram.com/gpalm79/Sarah Whittle: https://www.instagram.com/rudeunicorns/Check Out Our Other Smosh Channels:Smosh: https://smo.sh/Sub2SmoshSmosh Games: https://smo.sh/Sub2SmoshGamesSmoshCast: https://smo.sh/Sub2SmoshCast"
"TmYX0D6Sunk","Samurai Jack: Battle Through Time - Official Announcement Trailer","2020-02-25T16:00:07.000Z","UCKy1dAqELo0zrOtPkf0eTMw","IGN","20","20.03.03","IGN|Trailer|Adult Swim|Samurai Jack|Samurai Jack: Battle Through Time|samurai jack game|samurai jack game trailer|ign samurai jack|gaming|game trailers|games|video games","1452588","68303","674","4851","https://i.ytimg.com/vi/TmYX0D6Sunk/default.jpg","False","False","Samurai Jack: Battle Through Time is a brand new, 3D hack-and-slash where players control Jack as he travels through different timelines towards his final showdown with Aku.#ign #gaming #samuraijack"
"E5TQvvwzyMk","Everything Wrong With Terminator: Dark Fate In Zzzzzzzz Minutes","2020-02-25T15:43:13.000Z","UCYUQQgogVeQY8cMQamhHJcg","CinemaSins","1","20.03.03","terminator|arnold|cameron|dark fate|linda hamilton|terminator: dark fate|cinemasins|cinema sins|everything wrong with|eww|movie|mistakes|review|wave jockey job|eww terminator dark fate|everything wrong with terminator dark fate|cinemasins terminator dark fate|terminator dark fate review|movie review|the terminator","911857","25257","821","4371","https://i.ytimg.com/vi/E5TQvvwzyMk/default.jpg","False","False","This movie is just good enough to make you mad about how bad it is. For a half hour, it's ass-kicking fun, and then it goes and gets sentimental about the past and it all falls of the rails. Here are the sins of Terminator: Dark Fate.Thursday: More unnecessary sequel sins.Remember, no movie is without sin! Which movie's sins should we expose next?!Patreon: https://www.patreon.com/CinemaSins Podcast: https://soundcloud.com/cinemasins TVSins: https://www.youtube.com/channel/UCe4bOvc1mYxFcQ5xPb9Zmow MusicVideoSins: https://www.youtube.com/channel/UCUBq8oBRVTsMpjWiHfjJpDw Twitters...Jeremy: http://twitter.com/cinemasins Barrett: http://twitter.com/musicvideosins Aaron: http://twitter.com/aarondicer Jonathan: http://twitter.com/samloomis13 Denee: http://twitter.com/deneesaysMerch: https://teespring.com/stores/cinemasins-storeSubreddit: http://reddit.com/r/cinemasins Website: http://cinemasins.com SinCast Facebook page: https://www.facebook.com/SinCastCinemaSins#CinemaSins#DarkFate#Terminator"
"ShDVKJJ9Coc","Michael Jordan speaks at public memorial for Kobe and Gigi Bryant","2020-02-24T20:24:46.000Z","UCzF4Ryn8TKn64md77gS5Q5Q","11Alive","25","20.03.03","sports|national","8020956","174881","4138","13172","https://i.ytimg.com/vi/ShDVKJJ9Coc/default.jpg","False","False","Kobe Bryant and his daughter Gianna passed away in a tragic helicopter crash last month. They were honored in a public memorial on Monday in Los Angeles.11Alive is Where Atlanta Speaks. We believe that news shouldn’t be a one-way conversation, but a dialogue with you. Join in, share your thoughts and connect with new perspectives. Follow 11Alive on Social: Facebook: https://www.facebook.com/11Alive/ Twitter: https://twitter.com/11AliveNews Instagram: https://www.instagram.com/11Alive/  Subscribe to 11Alive for exclusive content: http://bit.ly/11AliveSubscribe  Visit Site: https://www.11Alive.com/"
"xCat5fXRyyU","Star Wars: The High Republic | Announcement Trailer","2020-02-25T04:25:44.000Z","UCZGYJFUizSax-yElQaFDp5Q","Star Wars","24","20.03.03","Star Wars|Project Luminous|Star Wars: The High Republic|The High Republic|Lucasfilm|books|comics","2930750","95084","16804","16626","https://i.ytimg.com/vi/xCat5fXRyyU/default.jpg","False","False","Set 200 years prior to the events of Star Wars: the Phantom Menace, the Galactic Republic and the Jedi Order are at their height, serving and protecting the galaxy. Featuring brand-new stories from five authors set in an all-new era, this is Star Wars: The High Republic. Get the details on #StarWarsTheHighRepublic at StarWars.com #StarWars Subscribe to Star Wars on YouTube at http://www.youtube.com/starwarsLike Star Wars on Facebook at http://www.facebook.com/starwarsFollow Star Wars on Twitter at http://www.twitter.com/starwarsFollow Star Wars on Instagram at http://www.instagram.com/starwars"
